date,title,content,URL
"6 Dec, 2012","US Senate approves 'Magnitsky Act', ties it to Cold War era trade law's repeal","The US Senate has passed a new bill normalizing trading relations with the Russian Federation, while at the same time critisizing its former adversary s human rights record In response, Russian Foreign Minister Sergey Lavrov said Russia would take similar, reciprocative actions During a meeting with Hillary Clinton in Dublin, I confirmed that we will close entry to Americans who have been guilty of human rights violations, ù Lavrov said The act automatically repeals the Jackson Vanik amendment placing trade restrictions on Russia and establishes permanent normal trade relations (PNTR) with Moscow The Jackson Vanik amendment was enacted in 1974 during the Cold War and originally targeted the Soviet Union By enacting PNTR together with the Magnitsky Act, we are replacing Jackson Vanik with legislation that addresses the corruption and accountability issues that Russia confronts today, Senate Finance Chairman Max Baucus said on the eve of the vote The bill was approved by the House last month After the Senate s 92 4 vote vote it is en route to President Barack Obama for an executive signature The act, while finally normalizing trade relations with Moscow, will allow Washington to deny visas as well as freeze the assets of Russian officials allegedly involved in the death of the Russian lawyer, Sergey Magnitsky The bill also stipulates that future possible violations in the field of human rights would be prosecuted by the same measures Welcoming better trade relations, Russia has condemned the controversial Magnitsky Act incorporated into the bill The country s Foreign Ministry has dubbed the law s approval theatre of absurd ù We do not wish to give up the positive side of the relations we have laboriously built over the last two years, ù a statement on the ministry s website read following the vote But they should understand that the Senate s approval of the provision will have quite a negative impact on our cooperation perspectives The US surely takes sole and utter responsibility for that ùPrevious week, Russian Prime Minister Dmitry Medvedev warned that approval of the Magnitsky Act would trigger both a symmetrical and asymmetrical reaction from his country We absolutely dislike its link to the trade bill, he said It s inadmissible when one country tries to dictate its will to another Magnitsky case The Magnitsky case began in 2007, when British investment fund Hermitage Capital, one of the biggest foreign investors inside Russia, fell victim to a US$230 million fraud scheme The fund hired corporate lawyer Sergey Magnitsky, whose investigation brought forth names of officials in Russia s Interior Ministry he believed to be involved in the scam Soon after that, the lawyer was arrested on charges of assisting Hermitage Capital to evade tax and was put into a detention facility Spending a year there, Magnitsky suddenly died in November 2009 An inquiry into his death proved he had been denied crucial medical treatment His supporters allege the lawyer had been tortured in an attempt to get him to withdraw his accusations Investigation both into the lawyer s death and tax evasion charges continues Part and Parcel As Obama faces new pressure, Senate has practically ensured the executive s signature by combining both into one document, Aleksey Pushkov, the head of the Duma International Affairs Committee, told RT In order to make it impossible for President Obama to refuse to sign the Magnitsky Act, the lawmakers have presented it to him in the same package as the annulment for the Jackson Vanik amendment, ù Pushkov said This way Obama is being tricked to signing both as he fully understands that approving the Magnitsky Act could potentially damage ties with Russia If the Magnitsky Act and the abolition of the Jackson Vanik amendment were to be handed to the president separately, he could then approve the amendment but not sign the act, Pushkov explained On the one hand, Obama is being pressured by an anti Russian lobby in the US Congress On the other hand, the pressure comes from the American industrial and trade lobby, which is extremely †interested in the abolition of the Jackson Vanik amendment and improve its position in the Russian market, in light of its WTO ascension That s why these two different in meaning documents are being presented as one ù The reason for the Magnitsky Act is Russia s tendency to point out the American government s hypocrisy, believes commentator and journalist Don DeBar The Russian Foreign Ministry should respond to such an obvious insult, where the United States, probably the primary violator of human rights at this point in terms of scale, magnitude and depth, is pointing its finger at anyone, ù DeBar told RT Certainly a person who is having that finger in their face should reply point out, you have no standing to accuse us of anything, and stand up for themselves ù   ",https://www.rt.com/russia/magnitsky-bill-senate-approve-454/
"30 Oct, 2012",‚ÄòThe only US policy towards Syria is to blame Russia‚Äô- Russian MP," Weak, contradictory American policy concerning the Syrian conflict may result in disaster for Syria and Turkey, the head of the Duma International Affairs Committee, Aleksey Pushkov told RT Pushkov warned that Islamic radicals may come to power in Syria and said that Turkey could drag itself into ethnic war In the interview with RT S Anissa Naouai, he explained that only open negotiations, rather than backing a side, will solve the Syrian crisis RT:I d like to begin with diplomacy In the world today it seems even more powerless than ever with situations like conflict in Syria Do you think that there is a political solution, that through words we can have peace there?AP: I think the situation has extremely deteriorated since last spring and it looks more like a bloody deadlock that doesn t offer hope for peaceful solution Yet I think that international community can generate nothing better than Geneva communiqu√© adopted last June, which says that international community has to bring those sides to the negotiation table There is no secret here, there are no magical answers The answer is for both sides, Russia / China on one hand and so called friends of Syria , it is not through backing one of the sides in the conflict that it can be solved I think Russia and China are closer to this understanding than the United States or their European alliance or Saudi Arabia † Unfortunately, their stance until now has been, Assad days are numbered, he has to go , it is not a policy We should try to understand that it is not by arming and financing Syria s armed opposition that a solution can be found The armed opposition has no strength to dislodge President Assad President Assad seems not to have enough strength to crush the military opposition, so here we are really in deadlock So, on both sides we should find people who could start to negotiate RT:What about Turkey? Do you think we ll see any conflict between Syria and Turkey or anywhere else in the region?AP: Turkey can be dragged or drag itself into this conflict But I have a feeling that the leadership of Turkey understands very well that if they go too far in Syria it may become dangerous for Turkey itself You know that an important Kurdish man is living in Syria and in Turkey the Kurds are fighting for a free Kurdistan So Turkish involvement in the war in Syria may have a lot of traps for Turkey, it s not by chance that Turkey has refrained from crossing the border and sending its ground troops to Syria It is easy to go in, it s difficult to get out The story of all the conflicts in that region, Afghanistan, Iraq etc , shows that the decision to go in is taken in two days and it takes years and years to get out So I don t think that the Turkish government is really willing to have an open war with the Syrian government Those two states are basically on the brink of war and this is very dangerous because on the other side of the local map we have Iran and we have all this talk about possible military strike against Iran s nuclear capabilities It is kind of a knot that should be untied bit by bit, now I think it s high time to start to untie the Syrian knot RT: There s a deadlock, a lot of blood, thousands of people have been killed, infrastructure destroyed But [Syria] is not a country like Iraq or Libya that have oil to rebuild itself if we ever see an end to this conflict Who can possibly benefit from this fighting in what obviously seems to be a losing situation for both sides?AP: Syria has some oil but you re quite right it s not the amount which will be sufficient to rebuild the whole country Syria, by the way, whatever can be said about the rule of Assad family was a pretty decent, economically and socially, country in the Arab world I visited Damascus last February and the city produced a very good impression on me It was kind of a European city, it was very open city, open air city, very secular in style It is an Islamic country but somehow the style of living was very modern And you could see women sitting with their husbands in caf√©, nice restaurants Economically it was quite clear that Damascus was one of the points of attraction in this region So it s really a pity that the country that has been enjoying quite an important economic growth, which has now † descended into shambles And who will profit from the destruction of Syria? I think only those who re after establishing a radical Islamist regime in Syria There are some countries in the Arab world and the Muslim world that are financing radical Islamist forces and are quite willing in the case of Syria to support the Sunni radicals against the Shia who are now in power at the expense of the Christians, of the Kurds, of the Druze and other minorities that are living in Syria So in some capitals of this area this conflict is considered through completely different eyes, it s about installation of the Sunni rule in the country which had been ruled by Shia minority for 40 years But it was exactly the fact that this country was ruled by Shia minority that allowed to have that multi ethnic and multi confessional combination in Syria which worked I mean, for 40 years there have been no ethnic conflicts in Syria, there was no ethnic cleansing So my feeling is that what is being done today in Syria is an attempt to crush this multi ethnical and multi confessional peace and to establish one group of people and one religion who would be much higher above the others or even one brand of a religion that would be radical Islam and Sunni radical majority that would lead the country But I think we should see where it leads, look at Saudi Arabia where we have quite an Islamic minded government, let s put it this way, we don t have democracy there RT: And they get along great with the United States Where s the US stand in terms of regime change? They re very open, it s no secret that they want Assad to go And then, they re pushing on Russia and criticizing Russia that it s them and China who are blocking any kind of progress on a solution AP: The United States to my mind are completely mixed up here Actually they are the reason of the large part of all this mess has triumphed so to say in Syria The United States try to prove us that with the help of Qatar, where there s no constitution and the opposition is being crushed, or of Saudi Arabia, where there s no constitution and even the remote notion of what democracy is, they will establish freedom and democracy in Syria And I wonder who can believe this, I wonder whether the American diplomats, do they put two and two together The US position is completely flawed I think basically that the US themselves are at a loss in this situation, they don t know what will happen, they don t know who are the forces that will come to power When Hillary Clinton was asked on the Congress hearings, who are the people the United States support politically in Syria, she said I don t know And also she was asked why actually Mr El Zawahiri, one of the leaders of al Qaeda, says that Assad is their main enemy In a paradoxical twist of history, Hillary Clinton and El Zawahiri find themselves on one side of the fence against President Assad How America reached this unbelievable position, I do not know I think it is very contradictory, very weak, I think the US had no policy towards Syria and the only policy they have is to blame Russia They are very lucky to have Russia because at least they have somebody to blame If Russia was not around the void of American foreign policy on Syria would have completely been clear to everybody RT: Right, let s talk for a moment about the forces that will come to power in the US They are having elections very shortly What does that mean for Russia, does it matter who is going to be in office for the next four years in terms of foreign policy, to expect any changes either way?AP: Well, the Russian President said already a couple of times that we will work with the President who s chosen by the American people So I don t think that Moscow would like to take sides Unlike, by the way, our American friends who always like to take sides and who show that they would like to have this person as a President or that person as President, and the one who is popular in the country, they would not like him to become the President of Russia We have a different approach, but Mr Romney complicated everything Basically, he set the tone of this election to the extent as Russia is concerned and he made us choose almost immediately when he said that he considers Russia to be America s number one geopolitical foe After this the answer from Moscow is evident, who is the President we would like to win As I say, Mr Romney said it all So we definitely would not like to have a President who has some kind of negative attitude about Russia For half a year, or a year, if Mr Romney is elected, it would be a year of farcical, theatrical Cold War, mostly rhetoric, but still it will poison the relationship to a large extent I think the reset declared by Mr Obama, although it was very much criticized on both sides in the United States and in Russia, I think it has produced something And the most important result of that reset is that the tonality has changed because basically the relationship between Moscow and Washington, between the Kremlin and the White House, turned to ashes in the last months of George Bush s second presidency The reset brought a new tone and atmosphere in the Russian American dialogue The relationships between Mr Obama and Mr Medvedev and even between Mr Obama and Mr Putin are decent relationships They have of course their complications and the differences have not gone away on a number of issues But still it s an atmosphere at which we can consider ourselves as partners Partners with disagreement but still partners With Mr Romney we will be forced to consider ourselves as enemies, so it s definitely preferable to have partner you heavily disagree with, than an enemy which would kind of be a clear cut enemy So I think that Russian choice in those American relations is absolutely clear RT News App © Autonomous Nonprofit Organization ÄúTV Novosti Äù, 2005 Äì2021 All rights reserved This website uses cookies Read RTPrivacy policyto find out more ",https://www.rt.com/news/syria-russia-conflict-policy-606/
"22 Oct, 2012",US media: Ideological arm of American foreign policy ‚Äì Russia,"Moscow will stop ignoring human rights violations in the United States, a high ranking Duma official said on Monday Russia has spoiled the Americans by keeping silent about (human rights) violations for the past 20 years, Alexei † Pushkov, the head of the State Duma s international † affairs committee told reporters on the sidelines of a parliamentary hearing on human rights in America Yeltsin tried to make (Bill) Clinton laugh and he just laughed at us, ù the Duma official said In short, we courted US favor, to gain its approval and they (the Americans) got accustomed to that; now, whenever we mention flagrant human rights violations in the US they are shocked and think we go too far, Pushkov noted The United States should honor human rights itself before trying to lecture other countries on these principles, he added The Duma official then slammed the US authorities criticism over Russia s shortage of media freedom When the US was attempting to justify the war in Iraq, the entire US media claimed the country had nuclear weapons, he recalled, a claim that turned out to be blatantly false Today, a similar situation is unraveling with regard to Syria as the Americans are taking an absolutely one sided position and their media acts as if it were an ideological arm of US ù foreign policy The head of the Duma International Affairs Committee then pointed to events in Libya, where rebels ousted former Libyan President Muammar Gaddafi The US media alleged Gaddafi was guilty of murdering 6,000 Libyan citizens, he said, but the bodies were never found and the theme was forgotten The single voice of the US media is startling, ù he continued It shows that the media simply serves the policy of the national authorities Commenting briefly on the presidential race in the United States, Pushkov said that in the event that the Republican challenger Mitt Romney defeated the incumbent Barack Obama, there would be an obvious regress for the American people Robert Bridge, RT   ",https://www.rt.com/russia/us-russia-media-human-rights-violations-956/
"3 Jul, 2012",Geneva decisions on Syria already being distorted - Lavrov,"Russia regrets the Syrian opposition s position on the Geneva conference, as well as that of some Western countries who wish to distort the agreements, FM Sergey Lavrov said It seemed to us that the consensus reached in the final communique is an important step to consolidate the positions of all members of the international community, the participants in the conference and Syrian sides, on the positions of a peaceful settlement and the refusal to solve the problem in the military way, Lavrov told reporters on Tuesday Unfortunately, some representatives of the Syrian opposition began to state that the Geneva decisions are unacceptable for them, the minister said Meanwhile, Lavrov pointed out that some Western participants in the meeting began to distort the agreements in their public statements The Russian minister stressed that the agreements that have been hammered out in the agreement should not be altered from their original context The Geneva agreements should not be distorted in any way, ù he said They mean just what has been written in the communique, and we will try not to rewrite anything afterwards Lavrov praised the agreements of the communiqu√©, saying they represent the best hope for achieving peace in the Arab nation Geneva gives good chances and they should be used, ù the minister stressed It is important that all players are pressing actively on all Syrian parties in order to make them stop violence and get down to the table of negotiations In separate comments, the Chairman of the State Duma s Foreign Affairs Committee Alexey Pushkov said Moscow and Washington interpret the Geneva agreements on Syria differently A war of interpretation broke out after the agreement on political transformation in Syria was signed in Geneva, he told reporters on Tuesday US Secretary of State Hillary Clinton is convinced the agreement makes it clear to the current Syrian leadership that it must go, he said Moscow, by contrast, said the agreement does not say a word about Assad s resignation and that he is not mentioned at all in it, the Russian lawmaker said Pushkov warned that disagreement over the document s meaning puts the US and Russia on a collision ù course † We are again witnessing a collision, ù he said On the one hand we can see the United States and the so called Friends of Syria who want Assad to resign On the other Russia and China are seeking an immediate end to the violence and the earliest possible beginning of talks between the Syrian government and opposition ùThe only common ground between the sides is the belief that the situation in Syria must be settled politically, he said, adding that the US is making Assad s resignation a precondition of the talks We advocate talks between the government and opposition, and the U S and others talks with Assad s simultaneous resignation In fact, they are advancing a precondition for the talks, he said Furthermore, the United States and its supporters actively dictate what the Syrian opposition s position should be, Pushkov said The rebels have announced already that they will not start talks before Assad s resignation, which indicates that they obey the logic dictated from abroad, the Duma official added, while also mentioning that a similar type of confrontation ensued over various interpretations of the UN Security Council s resolution 1973 on Libya, which led to NATO forces resorting to military action in that country An international conference on ways to resolve the deteriorating situation in Syria was held in Geneva on June 29 Robert Bridge, RT   ",https://www.rt.com/russia/russia-us-syria-geneva-talks-282/
