date,title,content,URL
"14 Jul, 2017","Trump-Russia dominates headlines, but there‚Äôs more evidence of collusion between Democrats & Ukraine","Ukrainian cooperation with the democraticparty appears to have been far deeper than any equivalent Trump Russia collusion Both pale in comparison to Washington s meddling in the former USSR But the US media focuses on the most illusory of the situations Bryan MacDonald is an Irish journalist based in Russia He has written for RT since 2014 Before moving to Russia, Bryan worked for The Irish Independent, the Evening Herald, Ireland on Sunday, and The Irish Daily Mail Follow him on Twitter@27khv Bryan MacDonald is an Irish journalist based in Russia He has written for RT since 2014 Before moving to Russia, Bryan worked for The Irish Independent, the Evening Herald, Ireland on Sunday, and The Irish Daily Mail Follow him on Twitter@27khv It s pretty obvious Donald Trump Jr isn t the brightest light in the firmament The lethargic, spoiled and languid persona he projects doesn t help either Nevertheless, the current hysteria surrounding his meeting a small time Russian lawyer is beyond any bounds of reason Especially coming from journalists who have surely met a dodgy source or two in their time, in the hope of a scoop Natalia Veselnitskaya was almost certainly not representing the Kremlin when she courted baby Trump Rather she waslobbyingon behalf of a client, mixed up in the Sergei Magnitsky case To that end, the ex UK tabloid hack Robert Goldstoneexaggeratedher usefulness to attract Donald Jr s attention By Trump s own account, he quickly sussed this distorted pretext and pulled back Plus, it s worth mentioning how she s also engaged plenty ofDemocratsas part of her campaign Nevertheless, certain media elements have been guilty of greater inflation than Veselnitskaya Including theNew York Times, which laughably labeled her a fearsome Moscow insider, ùwithout explaining how it was Moscow Oblast, not Moscow city, where she enjoyed this clout Because despite the shared name, the region and the metropolis are two different entities, roughly analogous to the relationship between Virginia and Washington DC Thus, the Times misleading headline was much the same as a Russian outlet hailing a Richmond based attorney as some kind of White House specialist There is another thing which makes this endless Trump Russia delirium even more dubious And that s how the US establishment will leap on any connection, no matter how vague, concerning the President s team and Russians, but ignores dealings between the democraticparty and Ukraine The elephant in the room which has been almost completely ignored, and was amazingly not even mentioned when Petro Poroshenko visited Washington last month Let s be clear, Ukraine feared a Trump presidency Because, on the campaign trail, the candidate had openly suggestedrecognizingRussia s reabsorption of Crimea and spoke of the Donbass crisis as a problem for Europe, not America As a result, Kiev bet the house on Hillary Clinton And lost As Politicoreportedin January: Ukrainian government officials tried to help Hillary Clinton and undermine Trump by publicly questioning his fitness for office They also disseminated documents implicating a top Trump aide in corruption and suggested they were investigating the matter, only to back away after the election And they helped Clinton s allies research damaging information on Trump and his advisers ù Now, this is pretty explosive stuff A credible American news organization is reporting how a foreign government directly interfered in the US election But the popular press didn t pursue the story Presumably, because its runs counter to the established narrative A Ukrainian American operative who was consulting for the Democratic National Committee met with top officials at the Ukrainian Embassy in Washington in an effort to expose ties between Trump, top campaign aide Paul Manafort, and Russia, according to people with direct knowledge of the situation, ùthe piece continued The Ukrainian efforts had an impact in the race, helping to force Manafort s resignation and advancing the narrative that Trump s campaign was deeply connected to Ukraine s foe to the east, Russia ù And here was the zinger: Politico s investigation found evidence of Ukrainian government involvement in the race that appears to strain diplomatic protocol dictating that governments refrain from engaging in one another s elections ù Later, Politicofocusedon the activities of Alexandra Chalupa, a Ukrainian American activist, who admitted acting as a link between Ukraine s Washington Embassy and the Democratic National Committee And also how Sergei Leshchenko, elected in 2014 as an MP for Poroshenko s party, had offered ledgers purportedly showing connections between Trump and Manafort before urging Ukrainian and American law enforcement to aggressively investigate Manafort ùIncidentally, Manafort has always been especially appalled at attempts to link his work to Russia, saying all my efforts were focused on helping Ukraine move into Europe and the West ù Leschenko wasn t coy about his intentions He openly admitted trying toexposeTrump as a pro Russian candidate who can break the geopolitical balance in the world, ùby preferring Moscow to Ukraine Furthermore, as The Atlantic noted: the investigation into the payments listed in the ledger îwhich in April were partially corroborated by theAPthrough wire transfers that Manafort claimed were legitimate îmysteriously faded after the U S election, raising questions about whether Ukrainian officials aired concerns about Manafort less to root out corruption than to undermine the Trump campaign ù Overall, Democrat Ukraine collusion seems far deeper than anything so far proven between the Trump campaign and Russia For instance, Donald Jr stands exposed as having been willing to meet someone described as affiliated with the Kremlin to get information on Hillary, which was pretty dumb The meeting itself appeared to be a bait and switch so the lawyer could lobby on other matters However, the Ukraine story involved a concerted and deliberate campaign, including cooperation between Kiev representatives and the Clinton camp to research Trump Kremlin connections Thus, If the issue is collusion, it s obvious there was much greater connivance concerning Ukraine and the Democrats than a single exchange involving Donald Jr and an insignificant lawyer One where no information was actually provided That said, American outrage over meddling from Kiev and Moscow is laughable in the context of Washington s long history of interference in both countries politics In 1996, the US openly intervened in Russia s election to help Boris Yeltsin defeat the Communist Gennady Zyuganov And in 2011, Washington officials, including Clinton, publicly supported a protest campaign over disputed parliamentary elections The following year,Michael McFaularrived as ambassador to Moscow and unabashedly courted fringe opposition leaders in his very first event in the role In Ukraine, the interruptions have had even more serious consequences By the admission of Victoria Nuland, a member of the Obama administration, Washington spent over$5 billionon influence projects in the country The first regime change ùoperation came in 2004 and was known as the orangerevolution ùAnd in 2013, US politicians and officials, such as John McCain and Nuland herself, turned up in Kiev to encourage the Maidan movement, in which the USambassadorGeoffrey Pyatt was prominent That led to the violent overthrow of a democratically elected government, which divided the country and caused the separation of Crimea and a civil war in the Donetsk and Lugansk regions And it also contributed to an economic collapse which has seen the average Ukrainian salary fall to around $200 a month and led to unprecedented levels of emigration For sure, Ukrainians didn t hide their hostility toTrump Interior Minister Arsen Avakov deriding the eventual winner as a dangerous marginal ùanddescribinghim as a clown ùon Twitter Many Russians publicly slammed Clinton, which was hardly surprising after shecomparedVladimir Putin to Hitler The fact remains there is no evidence of a direct Kremlin campaign to undermine America s election The media has almost totally ignored Kiev s transparent meddling to chase Russian ghosts All the while downplaying US manipulation of the political process throughout the former Soviet Union",https://www.rt.com/op-ed/396327-russia-ukraine-trump-clinton/
"13 Dec, 2016",McFaul‚Äôs Follies: One failed diplomat‚Äôs misguided attempt to destroy Russia-US relations,"Michael McFaul s suggestion that RT journalists be designated as foreign agents in the United States crossed a line By doing so, he targeted a lot of real professionals and threatened press freedom Bryan MacDonald is an Irish journalist based in Russia He has written for RT since 2014 Before moving to Russia, Bryan worked for The Irish Independent, the Evening Herald, Ireland on Sunday, and The Irish Daily Mail Follow him on Twitter@27khv Bryan MacDonald is an Irish journalist based in Russia He has written for RT since 2014 Before moving to Russia, Bryan worked for The Irish Independent, the Evening Herald, Ireland on Sunday, and The Irish Daily Mail Follow him on Twitter@27khv Nobody seems able to agree on whether P T Barnum or Walt Disney popularized the phrase always leave them wanting more ù It doesn t really matter whether it was the creator of Mickey Mouse or the architect of the museum of freaks ù Regardless of its provenance, quite a few pundits on the Russia beat would do well to heed the expression None more so than Michael McFaul, who appears in almost every popular press critique of the Kremlin these days In fact, America s former ambassador to Moscow is so thinly spread right now he s fast becoming the Porcelain Prince of the Russia cognoscente Over exposed and with skeletal arguments, based on emaciated facts So much so, Russia watchers have been asking: Does Michael McFaul ever sleep? ù And it now appears they might be onto something because the failed diplomat is showing signs of the kind of delirium which is often a telltale sign of slumber deprivation His latest brain fart is truly astonishing Amazingly, McFaul has taken to the pages of the increasingly hysterical and McCarthyist Washington Post to suggest how employees of RT should be classed as foreign agents under the Foreign Agents Registration Act ù He s stuck a question mark on the end, to leave himself some wriggle room But even the snake like punctuation symbol is no stumper here I dont know the truth about foreign involvement in our elections I want the American people to know #FactsMatter https:// tdotco /uLjcKjSyHX McFaul should, and certainly does, know better And his Twitter praise of RT s chief editor, Margarita Simonyan, for her fantastic job in the service of the Russian state ù is further proof of the duplicitous strategy at play here Because it s clear how these attempts to install a narrative that RT is solely serving the Kremlin, are designed to leave American staff of this network in an impossible position Despite the gormless veneer, the shameless professor is playing a shrewd game One old Joe McCarthy himself would have greeted with relish As there s no mention of similarly †foreign state funded outlets like BBC, Al Jazeera or France 24, all of which also operate in the US, it s clear how the target is to scare American journalists away from working for RT Now, while it may be water off a duck s back to a veteran like Larry King, it has serious implications for a young reporter Not to mention, the repercussions for Russian citizens employed by Western news organizations You see, the US has its own version of RT, called Voice of America and its own Sputnik too, Radio Free Europe/Radio Liberty Both of these began life as CIA cut outs, and they continue to be generously funded Indeed their parent, the BBG, has a budget around three times larger than RT Oh, and if you ve never heard of them, don t despair because you really aren t missing much But it might be worth looking at their charter, which insists they must be consistent with the broad foreign policy objectives of the United States Obviously, any attempt to restrict Russian media s freedom to operate in America would have knock on consequences for US equivalents here And from speaking to Kremlin officials, it s clear how it could also extend to private broadcasters and publications, given the imbalance in penetration In the sense that, while almost every major US entity has a Moscow correspondent, the inverse is not the same Thus, it s clear how this insensitive and dunderheaded punditry can make a lot of honest professionals feel very insecure Another problem with McFaul s supposition is where he attempts to convince readers how RT campaigned openly for one candidate, Donald Trump ù Put plainly; this is nonsense Because if the network was guilty of favoring a US politician in recent times, it s probably Jill Stein or Bernie Sanders, both of whom engaged with the channel frequently As did their supporters Also, on a personal note, I talk to RT employees very often, and none have exhibited any profound delectation over Trump s success, but quite a few expressed a fondness for Bernie All this is important in the context of an article headed let s get the facts right ù So is the manner in which McFaul informs us how we know that Russian actors stole data from people working at the Democratic National Committee ù But we don t know ù if it s true And McFaul provides no evidence for it Even ignoring how WikiLeaks chief Julian Assange has clearly stated how he didn t obtain the DNC files from Russian sources As a result, it s reasonably likely that the entire column is based on some dreaded fake news ù And this is certainly not something to be singing an aria about And you d think McFaul would have learned his lesson on making stuff up after WaPo used his comments to stand up the infamous PropOrNot ù piece which smeared around 200 media outlets as being agents of Russian influence? Only a few weeks ago, to boot Indeed, his own erroneous statement that RT tweeted out a crooked Hillary ù hashtag on social media has already been corrected by the newspaper READ MORE: Washington Post admits article on Russian propaganda & fake news based on sham research That said, despite how our subject seems to have made more TV appearances recently than Leonardo Di Caprio on an Oscar promotion push, there are probably plenty of people passing through life without knowing much about him So, here are the basics which he probably wouldn t dispute McFaul is a big fan of democracy promotion ù and a longtime Russia hand ù While the ever dwindling band of Russian liberals regards him as a force for good, the Russian establishment dislikes him immensely In late 2011, President Obama nominated him as US ambassador to Moscow And he was barely installed before controversy began Speaking to Russian journal Slon, he said: I m an expert on democracy and anti dictatorship movements for revolution And when I came to the USSR in 1989, it happened to be during such a movement And when I lived in Moscow, from 1990 1991, I became very close with the Russian democrats It was, perhaps, the best time of my life ù As these comments came a few months after US officials had supported the Bolotnaya protests ù they went down like a lead balloon in the Kremlin Around the same time, McFaul invited liberal opposition activists to the US embassy, which created a further outcry Subsequently, his ambassadorship vacillated between the mediocre and the contemptible until he resigned for family reasons in early 2014, as Ukraine burned While Dmitry Medvedev had cut him some slack, Vladimir Putin s return to the Russian Presidency left him cornered McFaul s perceived closeness to Hillary Clinton would have been bad enough, but his fervent support for Kiev s 2004 orangerevolution ù didn t help either Back to the idea of labeling RT employees as foreign agents As a journalist, I am absolutely appalled by McFaul s suggestion It is consistent with the most abhorrent elements of McCarthyism and reincarnates a specter that once seemed restricted to history books I m also tired of McFaul appearing in almost every article collated by Johnson s Russia List, a listicle that all Russia watchers ù of any standing digest daily Because he s manifestly the most obstinate, whiny, irascible, attention seeking windbag on a beat which boasts some of the most delicate, hypersensitive and thin skinned folk who ever breathed And if he blocks me on Twitter for this I don t care Footnote I asked McFaul on Sunday the following question: So, Michael, should Russian journalists working for @RFERL & @BBCNews register as foreign agents in Russia With all that implies? ù So, Michael, should Russian journalists working for@RFERL&@BBCNewsregister as foreign agents in Russia With all that implies?https:// tdotco /Hjd1plgOzp He ignored it Later, he claimed how lots of US reporters (sic) being denied visas to Russia ù Iqueried Could you name one, Michael? It s unusual that journalists would stay so quiet about something like this? ù This time, he did respond: I know three, all playing it quiet, trying to get off the list Head of BBG, of course, was denied entry and that was public ù My reply was Is Jeff Shell (BBG chief) a journalist? I asked you to name a journalist who has been refused (a) visa (say in last 12 months) Can you? Is (sic) very newsworthy ù Some thirty hours later, there has been no answer Is Jeff Shell a journalist? I asked you to name a journalist who has been refused visa (say in last 12 months) Can you? Is very newsworthyhttps:// tdotco /XreEGgiyxu Also, just for clarity s sake, I am referring to entry visas, not press accreditation The latter is a problem for bloggers and online video hosts in many countries, who still regard media as restricted to newspapers, magazines, television and radio Including Russia As an aside, on my own last trip to America, I had to give an assurance that I wouldn t engage in journalistic activity while there The alternative was the refusal of admittance But I guess I was one of the lucky ones Because, according toSlate, around that time at least 15 journalists from FRIENDLY countries have been forcibly detained, interrogated, fingerprinted, and held in cells overnight (in the US) îwith most denied access to phones, pens, lawyers, or their consular officials Indeed, one of those dangerous hacks was there to interview Olivia Newton John Making them clearly a threat to national security",https://www.rt.com/op-ed/370144-mcfaul-journalists-foreign-agents-russian/
"12 Nov, 2016",Soros-fronted orgs among groups calling for anti-Trump protests (VIDEO),"Some of the anti Trump protests in the US have been organized by groups that were sponsored by Clinton sympathizer and billionaire George Soros Among Wikileaks Podesta emails was a strategy document involving the Soros supported MoveOn org and grassroots organizing and funding MoveOn org issued a press release on Wednesday afternoon about the protests where they wrote hundreds of Americans, dozens of organizations to gather peacefully outside the White House and in cities and towns nationwide to take a continued stand against misogyny, racism, Islamophobia, and xenophobia ù ARE PAID PROTESTS REALLY PROTESTS? MoveOn Organizes Anti Trump Protests Around Country Breitbarthttps:// tdotco /7ESTmEV2FU Tonight, thousands of Americans will come together at hundreds of peaceful gatherings in cities and towns across the nation, including outside the White House, following the results of Tuesday s presidential election ù The gatherings îorganized by MoveOn org and allies îwill affirm a continued rejection of Donald Trump s bigotry, xenophobia, Islamophobia, and misogyny and demonstrate our resolve to fight together for the America we still believe is possible, ùthe statement continued Year 2012 George Soros predicts riots, police state and class war for America î RT America https:// tdotco /ZioLhdy5bj Those that are stirring it up, and many of them do work for Soros fronted organizations are really telling those innocent protesters, and perhaps less innocent protesters, they are in danger by Trump, even though Trump has done nothing but preach unity since he won the election, ùMarko Gasic, a British Serbian political commentator told RT on Friday The global elite s objections to in President elect Donald Trump is perhaps different from what they are telling protesters, Gasic said It s an election where they had all of the media, power and money and yet they ve lost to him, ùsaid Gasic It s a toss up now between the Clinton Soros view that the only democracy allowed is a one party democracy that agrees with what they say and if that doesn t happen they are ready to do a counter revolution to destroy that democracy and that democratic vote ù Soros gave Clinton step by step instructions on how to tackle Albania unrest WikiLeaks email î RT Americahttps:// tdotco /TEoukZEncj However, Gasic doesn t think they would try to get rid of Trump But they want to intimidate him to get him to agree to social peace at home as long as the global elites are allowed to pursue their wars abroad They want him to become a neocon just like they are, ùhe added Since Trump won on Tuesday, protests have occurred out in cities across the US, all of which are Democratic strongholds There have been three nights of protests, with more planned for Friday night and many slated for the weekend At a rally in Portland attended by more than 4,000 people on Thursday night, police declared it a riot and fired tear gas and rubber bullets at the crowd after claiming they were attacked by protesters They arrested 26 people Leading Democratic funders in California have started a campaign calling to reject the election results, arguing it was not consistent with the state s values Gasic believes someone is stirring the pot ùbecause America has never traditionally had a problem with accepting the outcome of an election ù We now have Soros behind many colorrevolution s in other countries and financing in effect a semi colorrevolution in US, ùGasic told RT, a reference to the orangerevolution in Ukraine, among others I don t know if it categorizes as treason He certainly operates from the shadows His only legitimacy is his wallet His only concern is to create the kind of democracy he can prop up and gain an interest from That s the kind of person who is behind this continuing protest against a valid, legitimate, free election ù #Soros funded#DNC superlawyer challenges voter ID laws to protect the Obama coalition https:// tdotco /UNwQFWT7GSpic twitter com/K12wDzI0kF Among the emails hacked from Hillary Clinton campaign chair John Podesta andpublished by WikiLeakswas one from September 9, 2007 that was sent from Podesta s think tank Center for American Progress and shared with MoveOn org It included an attachment, a strategy document seeking financial support from George and Jonathan Soros, Peter and Jonathan Lewis, Herb and Marion Sandler, Steve Bing, and John Sperling for grassroots efforts Although the prospect for continual electoral gains are solid and the assets of the progressive movement far better than in years past several gaps remain to be filled Chief among these is better connection between ground activity and substantive content and messaging, ùwrote Podesta in the 13 page document to Democratic funders In order to win next year, we must do a better job of controlling the public dialogue and overall framework of the election ù This latest leak includes 888 emails written to or from#HillaryClintonpresidential campaign chairman John Podesta https:// tdotco /LZjR3Fq02Kpic twitter com/ul3g8qnWsw Further in the document, it refers to controlling the political discourse by using the networks of grassroots organizing; multi issue advocacy groups; think tanks; youth outreach; faith communities; micro targeting outfits; the netroots and blogosphere to drive the content of politics through a strong echo chamber and message delivery system, ùstated the document And it is clear that each of you as individuals will play an important role in funding the remaining work ù In an article from 2004, the Washington Postrevealedthat Soros and his wife, Susan Weber Soros, gave $1 46 million to Move On org In 2014, a data analytics company called Catalist, specializing in progressive causes, received a new round of investment funding, including $2 25 million from liberal billionaire George Soros, CNN reportedat the time ",https://www.rt.com/usa/366579-soros-orgs-driving-trump-protests/
