date,title,content,URL
"10 Jul, 2019","Salvini aide negotiated fuel deal with Russians 'to fund political campaign,' BuzzFeed claims","An aide to Italian Deputy PM Matteo Salvini allegedly met some Russian officials to discuss details of a fuel delivery, which was meant to fund a political campaign, BuzzFeed has claimed in a report The meeting allegedly happened on the morning of October 18 last year in the lobby of Moscow s Metropol Hotel, coinciding with Salvini s visit to Russia Six people were at the table, three from each country, with Salvini s aide Gianluca Savoini being the only one identified by the publication BuzzFeed claims the discussion was about Russia s plan to secretly fund Salvini s party Liga ahead of the European Parliament elections, although the transcript of the negotiations doesn t necessarily confirm this assertion The one big name mentioned by the Russian side is Vladimir Pligin, a Russian lawyer, wealthy businessman and former MP He previously chaired the State Duma s commission on constitutional law and state building, and has a reputation as a liberal minded politician The deal that was allegedly discussed involved the delivery of fuel from Russia to Europe at a four percent discount The Italians mention that their primary interest is sustaining a political campaign, but it s not clear whether this referred to Salvini s campaign for May s European Parliament elections, as BuzzFeed alleges An election is mentioned once in passing during the conversation, with one of the Italians, a lawyer connected with a bank in London, saying they will be good Most of the conversation goes into details about how to expedite the shipments, with both sides agreeing on the urgency of closing the deal, according to the transcripts This includes keeping the financial part within one bank in order to avoid a lengthy know your client check, which BuzzFeed implies was necessary to cover up something nefarious The publication doesn t explain why such a sensitive deal would be negotiated in a hotel lobby Neither does it say who recorded the talks or how the recording was obtained Only small portions of the audio were published by the website #BuzzFeed s founder faked identities to spread misinformation reportspic twitter com/iwwrQzggcN One small detail in the transcript seems especially puzzling During some small talk, one of the Russians complains about the rules in Italy, which require putting graphic images on cigarette packs He says: This country is very more favorable to smokers, no pictures at all This has not been the case since 2017, though BuzzFeed claims the meeting was held in October 2018 The BuzzFeed article bases its story on an earlier article about the alleged meeting, which was first reported in February by the Italian L Espresso magazine Only this time BuzzFeed published a transcript Salvini responded to the BuzzFeed publication by denying that Liga had ever received funding from Russia, reiterating his earlier denials after L Espresso report Buzzfeed itself, meanwhile, has been no stranger to controversy when it comes to reporting anything linked to Russia Over recent years, the New York based news outlet hasn t been held back as it consistently pushed the Russiagate narrative about a supposed collusion between US President Donald Trump and Moscow It reported earlier this year that Trump had directly instructed his former lawyer Michael Cohen to lie to Congress about shelved plans to build a Trump Tower property in Moscow At that time, BuzzFeed s reporting prompted Special Counsel Robert Mueller to openly deny the claims months before presenting his report on the Trump campaign s alleged collusion with Russia Buzzfeed was also the one to publish the infamous Steele dossier a report by an MI6 spy turned private investigator which contained unverified allegations that Russia blackmailed Trump and was one of the starting points of the Russiagate narrative in the first place None of the allegations presented in the dossier were proven Instead, the author himself admitted that the report was partly based on an unverified internet post Other reports suggested that the information for the dossier was fed to the author by people close to Hillary Clinton Trump s rival in the 2016 presidential elections",https://www.rt.com/news/463861-buzzfeed-salvini-aide-russia-fund/
"17 Dec, 2018",More US weapons to Ukraine will only make conflict worse ‚Äì Russian lawmakers,"Additional and ongoing ù US weapons deliveries to Kiev would escalate tensions and undermine efforts for peace in Ukraine, Russian officials said after US special envoy Kurt Volker announced such plans, along with more sanctions Moving through Congress is a military financing package of around $250 million and the ability to sell additional equipment, ùVolker told reporters in Brussels on Monday Within the next months there will be some announcements about the first tranches And it will be ongoing ù He also claimed that Ukraine is under attack ùby Russia and advocated for a Western military presence near or even inside that country, to raise the visibility of Russia s actions ù The notion of imposing additional sanctions on Russia over the November 25 maritime incident in the Kerch Strait seems to be gaining some traction ùamong Washington s allies in Europe, Volker said, hinting it might happen in the next month or two ù Happy to join üá∫üá¶Deputy PM@IKlympush, Deputy Director General of DG NEAR@kmathernova, and Chief Economic Advisor to the PM of üá∫üá¶ Ivan Miklo≈° on a@MartensCentrepanel to discuss the#UkraineReformsnecessary to strengthen Ukraine s resilience in the face of üá∑üá∫ aggression Russian lawmakers slammed Volker s statements as destructive, saying the US envoy was contributing to escalating tensions in Ukraine rather than resolving them peacefully This confirms once again that the US regards Ukraine as a puppet and a proxy for implementing its aggressive designs against Russia, ùYuri Shvytkin, deputy chair of the Duma s defense and security committee, told RT By supplying Ukraine with any types of weapons, the US encourage the escalation of tensions with Russia in the first place, which of course does not benefit stability in the region, ùShvytkin added Talk of a western military presence is actually contributing to Ukraine s unwillingness to implement the Minsk agreements and prolonging the conflict, the lawmaker argued The Minsk process halted the open warfare between the two provinces in east Ukraine that refused to recognize the 2014 coup, and the government in Kiev, which has portrayed the conflict as Russian aggression ù Last month, three Ukrainian patrol shipsattempted to forcibly sailfrom the Black Sea to the Azov Sea through the Kerch Strait, and were detained by the Russian coast guard On Monday, Volker seemed to side with Kiev, and accused Russia of aggression against Ukraine Russia chose to escalate in Black Sea, and it s now past time for Russia to choose#peace4Ukrainehttps:// tdotco /DHp5KoBqoL Russia did nothing illegal, so there is nothing for the US and its vassals to respond to, ùSenator Olga Kovitidi, member of the Federation Council s defense and security committee, told RT US actions are aimed at the global escalation of conflicts through incitement and unfair competition ù Statements that qualify as systemic provocations ùhave already become an integral attribute of US foreign policy, ùsaid Kovitidi If the border of our country is violated by anyone, there will be an appropriate response, ùsaid Shvytkin Volker became the US special representative to Ukraine in July 2017 His appointment was seen as a signal of a more hardline policy in Washington, given his previous service as the US envoy to NATO under presidents George W Bush and Barack Obama Though US President Donald Trump advocated better relations with Russia during his 2016 campaign, he has since gone along with hardliners in Washington due to the constant but unsubstantiated accusations that he colluded ùwith Russia to steal ùthe election from Hillary Clinton The Trump administration has already approved the sale ofanti tank missilesto Kiev, and budgeted $200 million for weapons deliveries in 2018, with an additional $250 million in the budget for the 2019 fiscal year     ",https://www.rt.com/news/446723-ukraine-weapons-russia-volker/
"21 Mar, 2018",Russian election: Western demonization of Putin has made him more popular in Russia,"Western leaders and opinion formers believed sanctions and economic pressure would encourage Russians to turn against Vladimir Putin They couldn t have been more wrong Bryan MacDonald is an Irish journalist based in Russia He has written for RT since 2014 Before moving to Russia, Bryan worked for The Irish Independent, the Evening Herald, Ireland on Sunday, and The Irish Daily Mail Follow him on Twitter@27khv Bryan MacDonald is an Irish journalist based in Russia He has written for RT since 2014 Before moving to Russia, Bryan worked for The Irish Independent, the Evening Herald, Ireland on Sunday, and The Irish Daily Mail Follow him on Twitter@27khv If you re not Russian, you probably haven t heard of Aleksey Pushkov He s an influential academic, politician, and media personality who once ran the Foreign Affairs Committee of the Duma (the lower house of the parliament) and is widely considered to be close to the Kremlin In the early hours of Monday morning, as the extent of Vladimir Putin s latest presidential victory became clear, he took to Twitter to make a very important point: western demonization of Putin inspires the opposite effect in Russia Instead, citizens rally around him And the election results confirm this ù Influential Russian politician & commentator Alexei Pushkov says western demonization of Putin causes the opposite effect in Russia Instead, citizens rally around him And the election results confirm this https:// tdotco /IPgDfW8Zsb Pushkov is correct Because Putin s latest landslide was partially made in the West To understand why, we need to rewind the clock to 2011 Back then, on the surface at least, Russia was doing well economically The ruble was trading around 30 to the US dollar and the price of oil was high While the country s reliance on the latter resource was always a poor long term strategy, it provided easy money And this meant Russians could afford to travel to places, and buy imported products, which Soviet citizens could only have dreamed of, two decades earlier Despite this, a considerable amount of people weren t happy And when the sitting president, Dmitry Medvedev, announced in September that he was stepping aside to support Putin s (who was serving as prime minister) return to the Kremlin, anger grew in some sections of society, especially the pro business and liberal factions You see, for them, Medvedev represented the promise of liberalization and westernization, and the return of Putin was seen as a step backwards towards nationalism, conservatism, and even authoritarianism In December, the Duma election took place, with United Russia, the party associated with Putin and Medvedev, failing to win a majority of the vote Some alleged the contest had been falsified and the party s real share was even smaller READ MORE:America s elite thinks it has a divine right to rule the world As a result, protests kicked off, largely centered in Moscow But there were also demonstrations in many provincial cities, including Khabarovsk, more than 8,000km from Moscow, where I resided at the time At this moment, one thing was very clear: many Russians sought a new sense of identity, and the various post Soviet factions were heading for a showdown One which took place over the following months In December, the Western media had decided to christen the unrest as the Snow Revolution , amemewhich conjured memories of similar events in Ukraine and Georgia, labelled Orange and Rose respectively And this was a serious error because Russians weren t looking for the overthrow of their state And, at least in the heartland, many feared a return to the anarchy of the 1990s Thus, while certain capital city circles sizzled with talk of revolution, where I was living, people seemed horrified by the very idea This is the rich Moscow elite marching, these guys have nothing in common with me, ù was a typical statement While others seemed to think the protestors were ungrateful, because, after all, their very prosperity was mostly down to Putin, who had inherited a basket case economy in 2000 and greatly improved living standards Nevertheless, things became very tense for a while, with no less a figure than Mikhail Gorbachev publiclycallingfor Putin to resign † Of course, Putin didn t heed Gorby s call Instead, he continued his presidential campaign and in March 2012, won handsomely, with a score of 63% nationally, but only 46% in Moscow Now, this is where I need to explain something: the 2011/12 protests were, more or less, a big smoke ù phenomenon And it explains † why Western media correspondents, who are all based in Moscow and have little understanding of the rest of Russia, beyond itsoccasionalnovelty value, made their readers and viewers believe something substantial was stirring when the reality was less dramatic Because, in a place like Khabarovsk, the movement gained no traction beyond a bit of muttering in cafes and between close family and friends Putin realized this and learned a lesson In his first two terms, he d probably spent too much time worrying about the Moscow elite From now on, he was going to focus on his base, the ordinary folk who keep Russia working And little did he know at the time, but the West was about to lend a helping hand The KremlinbelievedHillary Clinton had interfered in Russia s 2011/12 unrest, but her influence was limited, even if Putin s team regarded it as a betrayal However, America s behavior in Ukraine in 2013/14 was another matter entirely This was the US openly intervening in street protests in Russia s neighbor and Clinton s former assistant secretary of state,Victoria Nuland, was leading the charge eventually even going so far aschoosinga new government in the aftermath For Russians, it was incredible Ukraine, home to entire regions where ethnic Russians constitute a significant majority, was, as they saw it, being destabilized in a Western backed coup Something which meant that Crimea, part of Russia for hundreds of years until Nikita Khrushchev signed it away in the 1950s, could have feasibly wound up housing NATO bases Thus, when Putin decided to reabsorb the peninsula in the spring of 2014, his popularity ratings reached unprecedented levels Because Russians believed the West had betrayed them And, since then, the EU and the US have played into his hands Russians are fully aware of Western scaremongering about their country and the demonization of their president They see it on news sites, across social media, and on TV And the ones who can t understand English can even read Russian translations of the Western press on a dedicated website, Inosmi (which, incidentally, is state funded) Furthermore, in addition to the constant barrage of media delirium, the NATO countries sanctions policy has created a besieged fortress mentality in Russia Indeed, Andrey Kondrashov, Putin s campaign spokesman, summed this up on Sunday night Turnout is higher than we expected, by about 8 10 percent, for which we must say thanks to Great Britain, ù hesaidwith tongue surely in cheek, referring to the fallout from a spy poisoning drama in the UK We were pressured exactly at the moment when we needed to mobilize [voters] Whenever Russia is accused of something indiscriminately and without any evidence, the Russian people unite around the center of power And the center of power is certainly Putin today ù In 2012, Putin was under pressure in Moscow, but this weekend he secured over 70% of the vote in thecapital And in St Petersburg, where he managed 58% six years ago, he can now boast a 75% score And it has happened at a time when Russians have endured a deep recession, with falling real wages, during a painful, but necessary, economic restructuring after the previous resource driven model exhausted itself Today, even liberal, educated, and cosmopolitan dwellers of the two big cities generally support the status of Crimea and now resent the West for its anti Russia hysteria Whereas in 2011 12, many saw the US as a country to aspire to, now they are disappointed with Washington and believe the US to be fundamentally opposed to respecting any of Russia s vital interests READ MORE:Putin s landslide victory to attract additional $30bn to Russian economy Thus, ironically, a Western policy aimed at weakening Putin and reducing Russian resolve has completely backfired Eighteen years after he first entered the Kremlin, the president s position has never been stronger, or more secure And he can thank the dysfunctional and self destructive policy of the United States and the European Union A lot of which is influenced by too much reliance on Russia experts ù who don t really understand the country at all And it shows",https://www.rt.com/op-ed/421944-putin-election-demonized-west-victory/
"29 Dec, 2017",2017 could have been year Russia and US made up. Now they stand on brink of new Cold War,"On this day 12 months ago, Moscow held off from retaliating to Barack Obama s diplomatic parting shot, in hope of a new start Instead, 2017 has been the worst year of US Russia relations since the fall of the Berlin Wall Three weeks before leaving the Oval Office, Obama expelled 35 Russian diplomats and closed two Moscow owned properties in the US over claims of election meddling Counter measures were expected I invite all children of US diplomats accredited in Russia to the New Year and Christmas children s parties in the Kremlin, ùRussian President Vladimir Putinannouncedinstead, capitalizing on the moment to show unexpected festive magnanimity Yet by that point Russia s bogeyman role as the explanation of the Democrats loss in the 2016 election, and the weapon with which to delegitimize the incoming President Donald Trump, was set Shattered , the sympathetic chronicle of Hillary Clinton s doomed presidential run,detailshow less than 24 hours after the concession speech ùher campaign manager John Podesta and his team gathered at their emptying headquarters to forge the narrative for the coming months in which Russian hacking was the centerpiece ù On January 10, 2017 BuzzFeedpublishedtheDNC fundedChristopher Steeledossier a historic document not for the revelations contained therein, but as a marker for the strength of sentiments against Donald Trump, and a watershed for the deliberate dropping of US journalistic standards for a political cause An alliance between the bitter Republican establishment and vengeful Democrats has since formed in Congress, driving the anti Russian agenda throughout the year The sanctions bill overwhelmingly passed in July designated Russia alongside Iran and North Korea as America s official adversaries ùIt also charged Moscow with such a wide ranging list offenses encompassing Ukraine, Syria, hacking, energy security threats and a similarly lengthy list of targets from politicians, to oligarchs, to companies, to banks that even with the best will in the world, it is not clear that the Kremlin could fulfil any specific criteria to have them removed Congress also did not pass up the opportunity to humiliate its president like an untrustworthy child, by placing severe restrictions on Trump s ability to loosen any of the measures regardless of international dynamics, thus rendering all future diplomatic efforts likely futile Hence the pitiful sight of Trumpsigningthe bill into action even as he denigrated it as deeply flawed ù Unsurprisingly, Moscow said that the measures would result in an out and out trade war ùwhile Putin called them illegal ùand bemoaned that US Russian relations are being sacrificed to resolve internal policy issues ù The act gave the start to the most unedifying tit for tat saga of the year, in which both sides tasked themselves with calculating exactly how many consular staff they needed to expel to reach parity ùin the stand off, and arguing over whether each step was an escalation or merely the just response in the dispute In response to Congress and those initially unanswered expulsions, PutinorderedUS missions to reduce their payroll by 755 employees One month later, in late August, the White House gave Moscow 72 hoursto shutterthree of its diplomatic buildings, including its oldest consulate in San Francisco, which in turn led to threats oflawsuitsfrom the Russian side, unhappy about being forced out of properties it owns The drip drip of hostilities has carried on through the past three months, with many of the announcements centered on international media Following the US order to single out RT America as a foreign agent ù a designation originally created to root out Nazi propagandists before World War II Washington and Moscow have engaged in one upmanship, with the Russian Duma passing a mirror bill, which reduced what was already a nebulous term into a playground insult In an example of the pettiness and the low stakes, RT has been stripped of its congressional credentials and US reporters can no longer visit the Duma None of the above measures will pave the way for a d√©tente, but what if this is not the American aim? After all, the White House national security strategy published earlier this month talks of preserving peace through strength, and advancing American influence in the world ùall while promoting our way of life ùIn turn, Russia is described as challenging American power, influence, and interests, attempting to erode American security and prosperity ù If the US yardstick of success is not peace but domination, then punishing the Kremlin is a success, and the question becomes, is the US treatment of Russia effective in asserting its superiority and changing Moscow s behavior? ù But on this score 2017 has also been a failure for the US, due to a lack of a coherent approach, as even John McCain would admit Trump has spoken of healing ùrelations with Moscow that talk has been echoed by his lieutenants and does not come across as an obvious figurehead in a new Cold War However, he hasn t been so much as able to exchange several words with Putin at an official dinner without being brandeda traitorby large swathes of the establishment On the other hand, no one appears to have been pushing Trump to order the consulate closures, which aggravated the Kremlin more than the more substantial but less arbitrary moves And yet when Trump made the decision, was he really motivated by a desire to achieve geopolitical results, or as a means of deflecting accusations about being friendly to Russia? Or did he do it at the behest of security and military officials the same ones whose hand can be seen inthe latest doctrine? This is chaos From the angle of effectiveness, if anyone has gained from the erratic US policy making it is Putin, who looks measured, consistent and statesmanlike in his pronouncements, while his officials speak with one voice, as Russia has clearly pursued a number of international policies over a period of several years While Putin can take solace from his increasingly prominent portrait as an international diplomatic mastermind outwitting the hapless Trump, it is obvious that the last 12 months have been a lose lose proposition for both Washington and Moscow The simmering morass leaves Russia cut off from the West, in a situation where international sanctions become the new normal Meanwhile, the White House misses out on a potential economic and diplomatic partner on issues from the Middle East to North Korea to the Arctic, and retains a regional rival forever capable of throwing around its international weight or scuttling a UN Security Council resolution Ironically, 2017 was geopolitically an opportune year for the two countries to mend relations Both countries can take credit fordefeating ISIS and not catching each other in the crossfire The Syrian conflict has swung decisively to President Bashar Assad s government, with the White House fully aware that from now on deal making could bring greater dividends than pouring more money and goodwill in the black hole of supporting the opposition The Ukrainian conflict remains intractable, but has receded in diplomatic importance, while accepting Crimean secession as a fait accompli has become plausible enough if the issue is not to poison Moscow Washington relations for decades to come Even if circumstances continue to be favorable in 2018, prospects for a thaw remain thin The Democrats will not let go of the Russia Trump story even if the investigation by Special Counsel Robert Mueller yieldsno smoking gun, while specific sanctions against Russia as a result of July s law will likely power a new spiral of strife Putin is the overwhelming favorite for re election, while Trump s political ratings don t give him much leeway Nor is his policy making growing more structured Over the next 12 months, in the face of inexorable inertia pulling apart Russia and the United States, a stagnant lull would likely count as progress Igor Ogorodnev for RT   ",https://www.rt.com/usa/414552-russia-us-diplomatic-crisis/
