date,title,content,URL
"8 Apr, 2010",Will US Republicans shoot down START treaty?,"President Barack Obama, on a political roll after passing his healthcare reform legislation, is set to face severe Senate scrutiny over his administration s arms reduction treaty with Russia Obama and Russian President Dmitry Medvedev met in Prague on Thursdayto sign the successor to the1991 Strategic Arms Reduction Treaty The long fought document commits both nations to slashing the number of strategic nuclear warheadsby one third, and more than halving the number of missiles, and the submarines and bombers carrying them While the atmosphere in the Czech Republic following the signing ceremony was one of jubilation, back on Main Street, USA the enthusiasm is much more muted as the Republicans search for ways to paint the treaty as a threat to US security The partisan battle over the American president s new nuclear initiative was best captured by Fox News during its coverage of Obama s departure for Prague, the chosen venue for the historic signing between the two former cold war foes President Obama heading for the Czech Republic as we speak, ùstarted the Fox anchor, who spoke as if she were reporting on the sinking of the Titanic Set to sign a new nuclear pact with Russia Now critics are asking: Will the new deal leave the US defenseless until it s too late? ù This is exactly the sort of argument that many members of the US Senate, most of them from the Republican Party, will be making in an effort to derail Obama s ongoing efforts to reset ù relations with Moscow, which many political pundits continue to associate with the defunct Soviet Union, as opposed to the capital of a modern and democratic Russian Federation It is important to remember in this context that Obama s Democrats enjoy a robust majority † but not the required 67, or two thirds, vote necessary to seal the deal without Republican support Stephen Rademaker, former head of the State Department s arms control bureau, suggested that some US senators might cast their vote against the treaty since the Russians, according to him, intend to use it as leverage to stop US missile defense initiatives already declared by Obama Is there an intention on both sides to live with this treaty, or are the Russians essentially coming to this wedding declaring that they want to get married but they don t intend to live in holy matrimony? Rademaker asked during a forum at the Heritage Foundation in Washington this week, as reported by Reuters The treaty does not contain any constraints on testing, development or deployment of current or planned US missile defense programs or current or planned United States long range conventional strike capabilities, according to a White House statement Once signed and submitted, the new treaty can expect close scrutiny by the Senate, ùwrote Strobe Talbott, the former US Deputy of State under the Clinton administration and president of the Brookings Institution Since the agreement affects vital US security interests, it should receive nothing less ù But Talbott seems confident that the Senate will conclude that the Treaty does not compromise America s security interests A final judgment will have to wait until we see the detailed treaty provisions, ù Talbott continued But based on what we know to date, the treaty will deserve to pass the merit test in the Senate ù The Republicans seem to understand that it would be politically risky to voice too many objections to the START treaty, especially when they are beginning to require a reputation as the just say no ù party Thus, they have decided instead to take up arms against Obama s revised Nuclear Posture Review (NPR), which was released Tuesday, two days before the START signing The White House s revised nuclear doctrine states that the US commits itself to reduce the role of nuclear weapons in deterring non nuclear attacks ùThe new enemy friendly approach applies to states that are party to the Nuclear Non Proliferation Treaty and in compliance with their nuclear non proliferation obligations ùClearly, this is a thinly veiled allusion to North Korea and Iran to get on board the NPT, or face international sanctions † or worse Still, some Republican (and neoconservative) commentators say Obama s new nuclear strategy weakens America s defenses Charles Krauthammer, a Washington Post columnist, whom the Financial Times in 2006 called the most influential commentator in America ù,provided a completely misleading assessment of Obama s nuclear doctrine in an interview with Fox News In the event of a biological attack on the United States, Krauthammer said the White House lawyers would ascertain if that country is in compliance with the NPT and if it is it gets immunity from a massive nuclear retaliation ù He then suggests that the Obama administration, if it found itself in such a situation [biological attack from a nation that complies with the NPT regime], would be forced to resort to TNT and marines shooting guns, ùa non apocalyptic scenario that he somehow finds insane or ridiculous ù Although it seems beyond doubt that the Russian Duma will give its legislative blessing to the treaty, Russian Foreign Minister Sergey Lavrov this week said that Moscow reserves the right to withdraw from the new START treaty if US missile defense threatens Russia s national security The Russian Federation will have the right to withdraw from the (new) treaty if the quantitative and qualitative growth of the potential of the US strategic anti missile defense starts exerting substantial influence on the efficiency of the Russian strategic nuclear forces, ùLavrov told reporters on Tuesday It goes without saying that we ourselves will determine the degree of this influence Although Obama s Nuclear Posture Review has no bearing on the START treaty, Republicans are using it to suggest that Obama is exposing the United States to outside threats The same ridiculous argument continues to be forwarded whenever his administration attempts to try the detainees of Guantanamo Bay in US civilian courts as opposed to closed door military tribunals, which only suggests that the Bush administration has much to lose if the terrorists ù are permitted to speak their minds in an open court But that s another story In the final analysis, the US Republicans are acutely aware that Obama has made nuclear non proliferation one of the pillars of his presidency, and in the spirit of American political games, the games will certainly continue With mid term elections just around the corner, the Republicans will ramp up the rhetoric that Obama is weakening the nation s resolve before a resurgent Russia ù But it was exactly such tired, worn out clich√©s that helped Obama win the White House in the first place The Republicans will have to do much better than mere fear mongering if they hope to derail START in the Senate Robert Bridge, RT Read also † New START Treaty Triggers Development of Non Nuclear Arms   ",https://www.rt.com/usa/republicans-shoot-down-start/
"7 Apr, 2010",START: trust me like I trust you,"Final preparations are being made for the signing of the historic nuclear disarmament pact START between Russia and the US in Prague on Thursday, April 8 One of the main hopes is that it will encourage other nations with nuclear weapons to reduce their arsenals as well the farthest reaching arms control treaty in nearly two decades After months of debate and negotiations it seems that the wait is over and on Thursday Presidents Dmitry Medvedev and Barack Obama will put pen to paper and formalize a new START treaty The United States and Russia are completing negotiations on the farthest reaching arms control treaty in nearly two decades, ùObama announced At the height of the Cold War it was estimated there were nearly 40,000 nuclear warheads deployed worldwide The original START treaty, signed in 1991, aimed at reducing the arsenals of the US and the USSR to 6,000 each Read START I treaty (full text) START I expired last December, and since then, the world has been looking to the two nuclear superpowers to take the next step The new agreement plans an unprecedented reduction to only 1,500 warheads each, a move that some hope will be an example to the remaining nuclear powers an important step in the direction of making the world safer I think the signing of this treaty is very important and I have no doubt that it will be an important step in the direction of making the world safer It will be the beginning of a process in which the diminishing of nuclear weapons will continue, ùnoted Javier Solana, EU foreign policy chief from 1999 2009 an important step in the direction of making the world safer In the past much of the focus of the START treaty has been on reducing delivery systems, but now there is a new twist in the START agreement linking strategic missile offense to defense The legal juridical linkage in the text of the treaty means that in case the US does something unilateral in order to strengthen their defensive potential † increase the number of interceptors, introduce other radar stations somewhere nearby and so on and so forth in case they improve their defensive capacity, that would mean that the balance has been damaged and that Russia has a legal right to get out of this treaty again and to take some additional measures to compensate for that unilateral development, ùclarified Konstantin Kosachev, the head of Russia s State Duma Foreign Affairs Committee What s new about START? Russian FM puts a word in The idea of an American missile defense shield in Russia s back yard has been one of the key points of contention in the new start agreement, but by connecting offensive and defensive capabilities it seems a compromise has been reached that can make both countries happy The first stages deal with regional defense systems which don t damage regional stability and don t pose any threat to Russia s strategic forces, ùexplained Russian Foreign Minister Sergey Lavrov If and when our monitoring of how those plans are implemented shows they are entering a stage of creating strategic missile defense systems, and our military experts interpret this as posing a threat to Russia s strategic forces, we will have the right to resort to provisions provided in this treaty ù A treaty billed as a new start between two countries paving the way for a future that could see a world free of the threat of nuclear war Russia s deputy Foreign Minister, Sergey Ryabkov, told RT the new treaty reflects a different level of trust between the two nations control but trust this is the essence of the philosophy implemented in this treaty Control but trust this is the essence of the philosophy in the area of verification which was implemented in this treaty We have a leaner, a more effective treaty, less heavy in terms of bureaucratic intricacies and more built upon a mutual trust, really acquired by the parties over the years since the Cold War ended, ùSergey Ryabkov stated control but trust this is the essence of the philosophy implemented in this treaty We have a system of verification that will allow us to check when it is necessary to do so to be sure that nothing goes undetected, but at the same time we have never intended to build a system even closer to the one that was in place when the Cold War type of relationship dominated our arms control agreements with the US, ùhe concluded Viktor Kamyshanov from the Federation of Peace and Conciliation believes the signing of the new START treaty is a good sign that the two major powers with nuclear armaments have come to the decision that they have to be leaders in this process ù He added that the fact that Russia and the US decided to limit their nuclear arsenals is a sign that nuclear weapons are not the means of the solution of international dispute ù Sergey Strokan, political analyst from Kommersant Newspaper, shares this point of view, saying that this treaty is not only about nuclear warheads, it is not only about the verification process † this is about the role of nuclear weapons in the world ù He also observed that by signing this treaty, Russia and US would show that nuclear weapons are becoming outdated ù With the START treaty, Russia and the US will have more moral right ù and international public opinion on their side, told RT Professor Evgeny Bazhanov, the vice president of Russia s Diplomatic Academy This will help to convince other countries with existing or planned nuclear capabilities to change their nuclear policies and slash nuclear arsenals Russia and America are interested for those countries not to have nuclear weapons and we will do our best to convince them not to do it, ùsaid the diplomat Mikhail Troitsky, a political analyst from the Macarthur Foundation, believes the new START treaty is an important milestone which gives further momentum for both sides to engage on other substantive issues ù Meanwhile President Barack Obama has unveiled a new American nuclear policy, ahead of signing the START treaty Hillary Clinton and Defense Secretary Robert Gates explained that it would narrow down the circumstances under which the US would use nuclear arms But the President warned that countries breaking international rules would remain potential targets   ",https://www.rt.com/usa/start-trust-treaty-conditions/
"12 Mar, 2010",ROAR: Russia-US reset ‚Äúneeds urgent resetting‚Äù,"Moscow and Washington should sign a new START treaty by April 12, otherwise it will be a complete fiasco, ù analysts warn The US Secretary of State Hillary Clinton will visit Moscow on March 18 19 for talks on the newnuclear arms reduction treaty She will also attend a meeting of the quartet of international mediators in Israeli Palestinian peace talks Clinton and Russian Foreign Minister Sergey Lavrov will discuss issues concerning efforts in the direction of non proliferation in the context of the April 12 13 nuclear security global summit in Washington If the new strategic arms reduction treaty is not signed by that date, it will seriously hamper the reset of Russian US relations, many observers warn Moscow and Washington have offered different predictions regarding the perspectives of the signing of the new treaty on strategic offensive arms reduction, ùKommersant daily said Russian Foreign Minister Sergey Lavrov recently sounded optimistic, saying that the treaty may be signed in the next two or three weeks ùthe paper said However, White House Press Secretary Robert Gibbs said no deadlines should be set for the signing, ùand, if needed, it would be approved after the April 12 13 nuclear security conference in Washington, the daily noted Unofficially, negotiators say that almost everything has been agreed in the document except the link between offensive and defensive weapons, or missile defense, ùKommersant said Russia and the US seemed to have agreed that the link should be reflected in the treaty, but Washington then backed out, a source close to the Geneva talks told the daily Moscow wants this link to be binding, the source said, adding that it may be reflected in an attachment to the document Another source of the paper in the Russian Foreign Ministry described as inappropriate ù the agreement between the US andRomaniathat had been announced recently In February, Romania and Bulgaria declared their intention to participate in the US missile defense program and confirmed that the talks are already underway Moscow and Washington agreed on the treaty s clause regarding the exchange of telemetric data, and Russia will provide its partner with information about only a limited number of missile launches, the paper said However, the formal linkage between strategic arms cuts and missile shield remains a sticking point If the link between defensive and offensive arm is fixed in the treaty, it may accelerate the ratification of the document when it is signed by the presidents The more detailed is this link, the easier it will pass the State Duma, ùKonstantin Kosachev, head of the parliament s Foreign Affairs Committee, told Kommersant Otherwise, the document will not be ratified by the State Duma, Kosachev said But the problem is that the US lawmakers are not likely to approve the treaty containing this link either, analysts believe Another round of talks on the START treaty that began on March 9 in Geneva can be considered decisive ù, observer Vadim Yelfimov said Many observers hastened to call it the last round, probably meaning that the document is almost ready, ù he said in a commentary for Regnum news agency But haste may be dangerous ù in the issues concerning national security, the observer noted, adding that Russia should demonstrate that it will never make unilateral concessions ù A realistic treaty ù should not proceed from the fact that the US is abandoning its missile program immediately, but it should create conditions for that, ùthe observer said The linkage between the START treaty and dynamics of missile defense is not only logical in military terms, it is necessary from a political point of view, because a normal cooperation between the two super powers will always be on the agenda, ùYelfimov noted Moscow has slowed down talks on the START treaty to demonstrate its discontent about Washington s plans to deploy missile shield, ùNezavisimaya Gazeta daily said Analysts agree that this has become the main stumbling block Russia is displeased with Washington, which has taken a unilateral decision to deploy a tactical missile system in southern Europe without consulting Russia, ùAleksey Arbatov, director of the Center for International Security at the Institute of World Economy and International Relations of the Russian Academy of Sciences , told the daily The plans of deploying missile shield in Romania and Bulgaria have been probably adopted outside the framework of the Russian US mechanism of mutual assessments of threats, which should have already started working, the analyst said At the same time, Arbatov has no doubts that the treaty on arms cuts will be signed anyway ù Moscow possibly expects a number of political steps from Washington, the daily said The US should confirm that it will not act unilaterally ùand is ready to assess threats jointly with Moscow, the paper added Russia also wants its partners to take the decisions on deploying a missile shield based on reports made by both parties assessing the threats, the paper said Moscow also expects the US to be ready to discuss the issues of missile defense during talks in the future, after the signing of the new START treaty, it added The pact itself should be signed by 12 April when the nuclear security summit starts, Arbatov believes Otherwise, it would be a complete fiasco, ùhe said, adding that in this case it would be senseless to speak about any nuclear disarmament or resetting relations ù Hillary Clinton will arrive in Moscow next week to reset relations that have already been reset, ùRossiyskaya Gazeta daily said The talks will be difficult as the Russian US relations have already started to stumble again, ùthe paper predicts The majority of analysts described the first meetings between President Barack Obama and President Dmitry Medvedev as encouraging, ù the daily said It seemed that Washington was ready for a serious breakthrough, but everything proved to be more modest, ùit noted Now there is no doubt that the reset itself needs urgent resetting, ùthe daily stressed In particular, the parties repeatedly said in autumn last year that the text of the new arms reduction treaty would be agreed on by December 5, 2009 when the START 1 expired, ùit said But only by January this year was the treaty 98 per cent ready, ùthe daily said, adding that the countries cannot accomplish the remaining two per cent ùMoscow had to react to the unilateral activities of the US in the missile defense sphere at the very least because the presidents of Russia and the US agreed to mutually assess threats first, and then decide where and when to place missiles, ùthe paper noted Sergey Borisov, RT   ",https://www.rt.com/russia/roar-russia-us-reset/
