date,title,content,URL
"27 May, 2016",Silencing America as it prepares for war,"Returning to the United States in an election year, I am struck by the silence I have covered four presidential campaigns, starting with 1968; I was with Robert Kennedy when he was shot and I saw his assassin, preparing to kill him It was a baptism in the American way, along with the salivating violence of the Chicago police at the democraticparty s rigged convention The great counter revolution had begun The first to be assassinated that year, Martin Luther King, had dared link the suffering of African Americans and the people of Vietnam When Janis Joplin sang, Freedom s just another word for nothing left to lose, ù she spoke perhaps unconsciously for millions of America s victims in faraway places We lost 58,000 young soldiers in Vietnam, and they died defending your freedom Now don t you forget it ù So said a National Parks Service guide as I filmed last week at the Lincoln Memorial in Washington He was addressing a school party of young teenagers in bright orange T shirts As if by rote, he inverted the truth about Vietnam into an unchallenged lie The millions of Vietnamese who died and were maimed and poisoned and dispossessed by the American invasion have no historical place in young minds, not to mention the estimated 60,000 veterans who took their own lives A friend of mine, a marine who became a paraplegic in Vietnam, was often asked, Which side did you fight on? ù A few years ago, I attended a popular exhibition called The Price of Freedom ù at the venerable Smithsonian Institution in Washington The lines of ordinary people, mostly children shuffling through a Santa s grotto of revisionism, were dispensed a variety of lies: the atomic bombing of Hiroshima and Nagasaki saved a million lives ù; Iraq was liberated [by] air strikes of unprecedented precision ù The theme was unerringly heroic: only Americans pay the price of freedom The 2016 election campaign is remarkable not only for the rise of Donald Trump and Bernie Sanders but also for the resilience of an enduring silence about a murderous self bestowed divinity A third of the members of the United Nations have felt Washington s boot, overturning governments, subverting democracy, imposing blockades and boycotts Most of the presidents responsible have been liberal Truman, Kennedy, Johnson, Carter, Clinton, Obama The breathtaking record of perfidy is so mutated in the public mind, wrote the late Harold Pinter, that it never happened Nothing ever happened Even while it was happening it wasn t happening It didn t matter It was of no interest It didn t matter Pinter expressed a mock admiration for what he called a quite clinical manipulation of power worldwide while masquerading as a force for universal good It s a brilliant, even witty, highly successful act of hypnosis ù Take Obama As he prepares to leave office, the fawning has begun all over again He is cool ù One of the more violent presidents, Obama gave full reign to the Pentagon war making apparatus of his discredited predecessor He prosecuted more whistleblowers truth tellers than any president He pronounced Chelsea Manning guilty before she was tried Today, Obama runs an unprecedented worldwide campaign of terrorism and murder by drone In 2009, Obama promised to help rid the world of nuclear weapons ù and was awarded the Nobel Peace Prize No American president has built more nuclear warheads than Obama He is modernizing ù America s doomsday arsenal, including a new mini ù nuclear weapon, whose size and smart ù technology, says a leading general, ensure its use is no longer unthinkable ù James Bradley, the best selling author of Flags of Our Fathers and son of one of the US marines who raised the flag on Iwo Jima, said, [One] great myth we re seeing play out is that of Obama as some kind of peaceful guy who s trying to get rid of nuclear weapons He s the biggest nuclear warrior there is He s committed us to a ruinous course of spending a trillion dollars on more nuclear weapons Somehow, people live in this fantasy that because he gives vague news conferences and speeches and feel good photo ops that somehow that s attached to actual policy It isn t ù On Obama s watch, a second cold war is under way The Russian president is a pantomime villain; the Chinese are not yet back to their sinister pig tailed caricature when all Chinese were banned from the United States but the media warriors are working on it Neither Hillary Clinton nor Bernie Sanders has mentioned any of this There is no risk and no danger for the United States and all of us For them, the greatest military build up on the borders of Russia since World War Two has not happened On May 11, Romania went live ù with a NATO missile defense ù base that aims its first strike American missiles at the heart of Russia, the world s second nuclear power In Asia, the Pentagon is sending ships, planes and special forces to the Philippines to threaten China The US already encircles China with hundreds of military bases that curve in an arc up from Australia, to Asia and across to Afghanistan Obama calls this a pivot ù As a direct consequence, China reportedly has changed its nuclear weapons policy from no first use to high alert and put to sea submarines with nuclear weapons The escalator is quickening It was Hillary Clinton who, as Secretary of State in 2010, elevated the competing territorial claims for rocks and reef in the South China Sea to an international issue; CNN and BBC hysteria followed; China was building airstrips on the disputed islands In its mammoth war game in 2015, Operation Talisman Sabre, the US practiced choking ù the Straits of Malacca through which pass most of China s oil and trade This was not news Clinton declared that America had a national interest ù in these Asian waters The Philippines and Vietnam were encouraged and bribed to pursue their claims and old enmities against China In America, people are being primed to see any Chinese defensive position as offensive, and so the ground is laid for rapid escalation A similar strategy of provocation and propaganda is applied to Russia Clinton, the women s candidate ù, leaves a trail of bloody coups: in Honduras, in Libya (plus the murder of the Libyan president) and Ukraine The latter is now a CIA theme park swarming with Nazis and the frontline of a beckoning war with Russia It was through Ukraine literally, borderland that Hitler s Nazis invaded the Soviet Union, which lost 27 million people This epic catastrophe remains a presence in Russia Clinton s presidential campaign has received money from all but one of the world s ten biggest arms companies No other candidate comes close Sanders, the hope of many young Americans, is not very different from Clinton in his proprietorial view of the world beyond the United States He backed Bill Clinton s illegal bombing of Serbia He supports Obama s terrorism by drone, the provocation of Russia and the return of special forces (death squads) to Iraq He has nothing to say on the drumbeat of threats to China and the accelerating risk of nuclear war He agrees that Edward Snowden should stand trial and he calls Hugo Chavez like him, a social democrat a dead communist dictator ù He promises to support Clinton if she is nominated The election of Trump or Clinton is the old illusion of choice that is no choice: two sides of the same coin In scapegoating minorities and promising to make America great again ù, Trump is a far right wing domestic populist; yet the danger of Clinton may be more lethal for the world Only Donald Trump has said anything meaningful and critical of US foreign policy, ù wrote Stephen Cohen, Emeritus Professor of Russian History at Princeton and NYU, one of the few Russia experts in the United States to speak out about the risk of war In a radio broadcast, Cohen referred to critical questions Trump alone had raised Among them: why is the United States everywhere on the globe ù? What is NATO s true mission? Why does the US always pursue regime change in Iraq, Syria, Libya, Ukraine? Why does Washington treat Russia and Vladimir Putin as an enemy? The hysteria in the liberal media over Trump serves an illusion of free and open debate ù and democracy at work ù His views on immigrants and Muslims are grotesque, yet the deporter in chief of vulnerable people from America is not Trump but Obama, whose betrayal of people of color is his legacy: such as the warehousing of a mostly black prison population, now more numerous than Stalin s gulag This presidential campaign may not be about populism but American liberalism, an ideology that sees itself as modern and therefore superior and the one true way Those on its right wing bear a likeness to 19th century Christian imperialists, with a God given duty to convert or co opt or conquer In Britain, this is Blairism The Christian war criminal Tony Blair got away with his secret preparation for the invasion of Iraq largely because the liberal political class and media fell for his cool Britannia ù In the Guardian, the applause was deafening; he was called mystical ù A distraction known as identity politics, imported from the United States, rested easily in his care History was declared over, class was abolished and gender promoted as feminism; lots of women became New Labour MPs They voted on the first day of Parliament to cut the benefits of single parents, mostly women, as instructed A majority voted for an invasion that produced 700,000 Iraqi widows The equivalents in the US are the politically correct warmongers on the New York Times, the Washington Post and network TV who dominate political debate I watched a furious debate on CNN about Trump s infidelities It was clear, they said, a man like that could not be trusted in the White House No issues were raised Nothing on the 80 percent of Americans whose income has collapsed to 1970s levels Nothing on the drift to war The received wisdom seems to be hold your nose ù and vote for Clinton: anyone but Trump That way, you stop the monster and preserve a system gagging for another war",https://www.rt.com/op-ed/344623-elections-us-war-obama-/
"30 Jan, 2014","US, EU meddling in Ukraine battle","In the heat of recent exchanges and deaths of protesters in Ukraine, many have lost sight of the insidious role key players in Washington and certain EU countries are playing William Engdahl is an award winning geopolitical analyst and strategic risk consultant whose internationally best selling books have been translated into thirteen foreign languages He has lectured as Visiting Professor at Beijing University of Chemical Technology and delivers talks and private seminars around the world on subjects of current importance from economics to oil geopolitics to agribusiness A widely discussed analyst of current political and economic developments, his provocative articles and analyses have appeared in numerous newspapers and magazines and well known international websites He is a Research Associate of the Centre for Research on Globalization in Montreal and member of the editorial board of Eurasia magazine Based in Frankfurt, Germany he may be reached via his websitewww williamengdahl com William Engdahl is an award winning geopolitical analyst and strategic risk consultant whose internationally best selling books have been translated into thirteen foreign languages He has lectured as Visiting Professor at Beijing University of Chemical Technology and delivers talks and private seminars around the world on subjects of current importance from economics to oil geopolitics to agribusiness A widely discussed analyst of current political and economic developments, his provocative articles and analyses have appeared in numerous newspapers and magazines and well known international websites He is a Research Associate of the Centre for Research on Globalization in Montreal and member of the editorial board of Eurasia magazine Based in Frankfurt, Germany he may be reached via his websitewww williamengdahl com Their agenda seems to be to force an immediate end to the elected
 Yanukovich government in Kiev and lock Ukraine into the EU and,
 ultimately, NATO Washington s agenda has little to do with democracy and freedom , and a lot to do with
 destabilizing Putin s Russia On Sunday, January 19, the eight week long series of protests and
 demonstrations against the government of President Viktor
 Yanukovich in Kiev escalated to a new level of violence Bands of
 right wing militants called Pravy Sektor (Right Sector), attacked
 Ukrainian police guarding government buildings and attempting to
 contain the protesters Demonstrators threw Molotov cocktails at riot police from the top
 of the Dynamo Kiev football stadium in central Kiev beginning
 January 19 Police responded by using stun grenades and tear gas
 against the mobs Vehicles were torched by the hooligans from the
 neo Nazi Pravy Sektor More than 60 police were hospitalized from
 barrages of rocks, stones and Molotov cocktails The core of Pravy sektor is made of the activists of radical
 groups, including Trizub , Patriot of Ukraine ,as
 well as UNA UNSO and the Svoboda (Freedom) ultra right
 party, which won nearly 10 percent of votes at the last
 parliamentary election in Ukraine They are pro EU The far right violent radicals told Radio Free Europe, a US
 Government media agency tied to the CIA and State Department,
 that they were preparing full bloody guerrilla war against the
 government Andrey Tarasenko, Pravy Sektor s coordinator warned, If they attack and try to carry out a bloody crackdown, I
 think there will be a massacre Guerrilla warfare will begin in
 Ukraine Tarasenko stated that their demands ùare to oust the
 current government and build a nation state in
 Ukraine What kind of nation state we must imagine They also
 demand that Yanukovich step down, but, generously enough, add
 that they would give him and his family 24 hours to leave
 the country safely ù On their VKontakte (In Contact) social network website, the
 organization calls for donations of items such as slingshots,
 steel balls, gasoline, laser pointers, glass bottles, chains, and
 pyrotechnics Their published manifesto is nothing short of bizarre: All
 those who at this point would try to tame the revolutionary
 energy of the masses should be proclaimed traitors and punished
 in the most severe way The time of peaceful singing and dancing
 at Maidan [Independence Square] is over This is a waste of time 
 There can be no negotiations, no compromise with the ruling gang 
 We will carry high the fire of national revolution ù Curious is the fact that in the beginning of the protests, Pravy
 Sektor members were calling themselves the Maidan
 self defense force They had been designated by the main
 opposition leaders Vitaly Klitschko, Arseny Yatsenyuk and Oleg
 Tyagnibok to provide security for peaceful protesters Now they
 clearly have split from the peaceful protests Even more bizarre is the fact that in recent days ambassadors of
 several EU member states, as well as the US and Canada have gone
 to Maidan to meet Pravy Sektor activists and learn how the
 headquarters of national resistance operates Instead of unequivocally condemning the rise of violent Ukrainian
 nationalism, which could turn Ukraine into another Yugoslavia or
 Libya, the West is only threatening President Yanukovich with
 sanctions, while turning a blind eye to the real Pravy Sektor
 danger The Tarasenko demands are virtually the same as ex boxer turned
 right wing politician, Vitaly Klitschko, the pro EU apparent
 favorite of Germany s Merkel government Klitschko has lived in
 Germany for the past several years The nominal reason for the latest explosive protests in Ukraine
 was passage of a series of emergency laws to control the civil
 disorder by the Parliament on January 16 which, among other
 things, restrict the right to protest, constrain independent
 media, and inhibit the operation of NGOs Evidence suggests that key players in the Ukraine protest
 movement are being steered and orchestrated by Washington funded
 NGO s like the National Endowment for Democracy, the German
 Marshall Fund in The United States (a Washington think tank
 financed by a donation from the German Parliament), and certain
 key neo conservative Bush Cheney leftovers in senior positions at
 the State Department Already on October 11, 2011, the German Marshall Fund hosted
 Vitaly Klitschko, then WBC Heavyweight Boxing Champion just
 entering Ukraine s political boxing ring, at a Washington meeting
 to discuss Ukraine s European perspective Again in 2012 during the October Ukraine elections The German
 Marshall Fund in the United States hosted a top level group of
 UK, French and German journalists to visit Ukraine, where they
 also met Klitschko The Marshall Fund journalists were told by
 the US Embassy officials in Kiev that, Ukrainian oligarchs
 would like to see a strong opposition to the Party of Regions in
 the new parliament in order to temper the enrichment of President
 Yanukovich s family ù That strong opposition is today headed by three very
 different political parties One which won a shocking 10 percent
 in the last elections and sits in parliament is Svoboda, a
 neo fascist nationalist party led by Oleg Tyagnibok Tyagnibok
 backed the US financed 2004 orangerevolution He is openly
 anti Semitic and anti Russian, once claiming that Ukraine was
 ruled by a Moscow Jewish mafia ùThe second largest
 opposition party, jailed opposition figure, Yulia Tymoshenko s Fatherland , led by Arseny Yatsenyuk, has signed an
 agreement to work with the neo fascist Svoboda The opposition figure most attractive to the West is ex boxer
 Klitschko, head of UDAR (strike), the smallest opposition party,
 who has spent the last years living in Germany In order to have
 a chance at a Parliamentary majority in 2015, Klitschko will be
 forced to make a coalition with Svoboda and its policies, even
 though he is trying a delicate tightrope act of claiming to
 distance from Svoboda s anti Semitic ultra nationalism In an Op Ed in the London Financial Times, Klitschko wrote, the official halt in Ukraine s European integration unmasks
 the true face ùof the Yanukovich regime î a cartel of
 commercial self interests that has captured public office and
 believes that political longevity can be bought by selling
 Ukraine s interests ùUkrainians, he warned, would not allow
 Yanukovich and his cronies to steal their future ùand
 if their views were not taken into account, more protests
 are yet to come ù A central role in encouraging the Ukraine protesters is being
 played by the US State Department, and especially Victoria
 Nulland A review of the official statements from Nulland, who met
 personally with opposition leader Klitschko in early December, is
 instructive of the open interference of Washington in the
 internal affairs of Ukraine Nulland a Hillary Clinton
 appointee who now is assistant secretary of the Bureau of
 European and Eurasian Affairs in the State Department did not
 respect a sovereign decision by Ukraine s government in November
 2013 not to accept the dismal terms offered by Brussels for a
 Ukrainian EU Association status The EU offer would have forced Ukraine to open its
 economy to free market rules in return for little 
 When Yanukovich told the EU of his government s decision in
 November, Nulland s spokesperson issued the following statement: We continue to support the aspirations of the Ukrainian
 people to achieve a prosperous European democracy European
 integration is the surest course to economic growth and
 strengthening Ukraine s democracy ùThat was an undiplomatic
 intervention on the side of the protesters designed to embolden
 the opposition It did indeed Then on December 5 in Kiev, after her meeting with Vitaly
 Klitschko, Nulland declared, There should be no doubt about
 where the United States stands on this We stand with the people
 of Ukraine who see their future in Europe ¶ ù She followed her speech with a high profile bizarre media
 photo op where she carried a single plastic bag of food to give
 to the opposition demonstrators Nulland s partisan pro EU
 comments were followed by a brazen appearance from Republican
 war hawk Senator John McCain a few days later, siding with the
 opposition in December McCain is chairman of the Board of
 National Endowment for Democracy s International Republican
 Institute, which has been in the middle of all US Color
 Revolution destabilizations since 2000 Most recently, on January 15, after attacking Russia for granting
 a vital $15 billion bond purchase to help stabilize Ukraine,
 Nulland all but outlined the standard US government template for
 election tampering that has been done in countless color
 revolutions since the NED s 2000 coup against Yugoslavia s
 Milosevic She told the US Senate, the use of violence and acts of
 repression carried out by government security forces and their
 surrogates have compelled us to make clear publicly and privately
 to the government of Ukraine that we will consider a broad range
 of tools at our disposal if those in positions of authority in
 Ukraine employ or encourage violence against their own
 citizens ù Nulland then issued a direct order to President Yanukovich: We call on him to make it credible through concrete actions
 to restore government accountability, rule of law and engagement
 with Europe and the IMF ùThen, referencing planned 2015
 national Ukraine elections, she added, US pre election
 assistance to Ukraine likely will include programs to support
 citizen oversight of the campaign environment and the conduct of
 the elections, independent media coverage and informed civic
 awareness and participation ùAnd finally, The State
 Department and USAID are reviewing how best to support Ukrainian
 civil society and media ù USAID is widely cited as a cover for CIA operations in foreign
 countries Victoria Nulland herself is a former assistant to Vice President
 Dick Cheney, and married to neo conservative guru, Robert Kagan 
 She was under fire when caught recently lying to the American
 people when she was Hillary Clinton s State Department
 spokesperson Nulland pushed her superiors then to completely
 delete numerous references of extremists linked to Al Qaeda in
 Benghazi and eastern Libya after the assassination of the US
 Ambassador She also persuaded more senior officials to delete
 information on at least five other attacks against foreign
 interests in Benghazi by unidentified assailants Washington is clearly out to destabilize the new Ukraine Russia
 economic cooperation by hook or crook On January 22, after
 severe Pravy Sektor violence, the American Embassy in Kiev
 announced it was revoking the visas of several unnamed Ukraine
 Government officials responsible for actions taken against
 protesters in November and December The latest negotiations between the Yanukovich government and the
 three main opposition party leaders îKlitschko, Arseny Yatsenyuk
 and Oleg Tyagnibok îhave led to the resignation of Yanukovich s
 Prime Minister Nikolay Azarov and his cabinet, and changes in the
 emergency laws proposed 10 days earlier Nine out of 12
 anti protest laws passed January 16 were repealed At this point, whatever agenda Victoria Nulland s State
 Department may have had in trying to woo Ukraine away from
 Moscow, the internal forces of instability, egged on by vocal
 support from the West, have made the outcome incalculable That
 is certainly not in the true interest of the EU, having a
 critical Central European nation of 45 million ungovernable, and
 a rising nationalist fascist Svoboda led party calling the shots 
 That would prove too much even for the legendary boxing talent of
 Klitschko",https://www.rt.com/op-ed/us-eu-interference-in-ukraine-402/
