date,title,content,URL
"26 Jul, 2011",US-Russia visa row heats up,"The Obama administration has imposed a travel ban on 60 Russian nationals, which Washington alleges are connected to the prison death of lawyer Sergey Magnitsky As uncertainties linger over the Obama administration s commitment to a true reset ù in bilateral relations with Russia, the visa blacklist against dozens of Russian citizens will certainly dirty the diplomatic waters Washington formally announced plans for its visa blacklist, as well as a move to freeze assets belonging to certain individuals Secretary [Hillary Rodham] Clinton has taken steps to ban individuals associated with the wrongful death of Sergey Magnitsky from traveling to the United States, ù the Senate document said Senior Russian government officials have warned us that they will respond if this [Senate] legislation passes, ù the document reads Their argument is that we cannot expect them to be our partner in supporting sanctions against countries like Iran, North Korea, and Libya, and sanction them at the same time Russian officials have warned that other areas of bilateral cooperation, including on military transit flights to Afghanistan, could suffer from the passage of this legislation Of course, Russia won t leave without attention such unfriendly acts and will take appropriate measures to protect the sovereignty of the country and its citizens against the unlawful acts of foreign states, the Russian Ministry of Foreign Affairs said in a terse statement on Wednesday † The head of the Russian Presidential Council for Human Rights Mikhail Fedotov on Tuesday said that the so called Magnitsky case was primarily Russia s internal affair, and warned that the US black list could have undesired consequences The idea of fighting crime and corruption in Russia is primarily our concern, Fedotov said in an interview with the Interfax news agency For us, it is crucial that all those who are really responsible end up on the Magnitsky list at the Russian, and not the U S border † We are doing everything we can to make sure that the people from this list are eventually barred not only from traveling to America, but also from leaving the country in any manner They should also stand trial, ù Fedotov went on to say † But the Russian HR official said that U S blacklists could prompt retaliatory measures from Russia We understand the noble goals But one also needs to see the potentially unpleasant consequences † This step can generate retaliatory visa restrictions on the part of Russia, ù Fedotov said When a country establishes visa restrictions against another † it is, of course, its sovereign right, but it is thus provoking the other side to set symmetrical restrictions † This appears to me to be extremely counter productive Russia stated very openly and clearly that it is looking to have all visa restrictions lifted, the official said Meanwhile, Moscow was warned against outside pressure being exerted in the case of the 37 year old lawyer who died while in pretrial detention †Investigators alleged that Sergey Magnitsky had conspired with William Browder, who has reportedly been banned from entering Russia, to set up dummy front firms to illegally buy and sell shares in Russian energy giant Gazprom In November 2009, Magnitsky died in prison following complications from an apparent case of pancreatitis This month, the authorities announced prison doctors would be prosecuted for neglecting to provide the appropriate medical care for Magnitsky while he was being detained The head of the Federal Penitentiary Service said last year that the service was partially responsible for the death of the lawyer Following Magnitsky s death, President Dmitry Medvedev put a law on the fast track that allows individuals suspected of white collar crimes, ù as they are referred to in the West, to be released on bail as determined by the courts Prime Minister Vladimir Putin called the death a tragedy Meanwhile, the Russian State Duma, or lower house, has been considering a bill that would target US officials with similar sanctions, referring to the extradition of Russian citizens from third party countries In 2010, alleged arms dealer Viktor Bout, a Russian citizen, was extradited to the United States following a lengthy legal battle in Thailand Bout, who has been the inspiration for at least one Hollywood film, now faces an uphill struggle to prove his innocence in the US court system Moscow expected to deliver harsh response At least one lawmaker, Leonid Slutsky, first deputy head of the State Duma Committee for International Affairs, says Russia s response to the sanctions imposed by the US State Department must be tough Of course, our response must be tough and harsh, Slutsky told Interfax on Wednesday,commenting on reports that the US State Department has obtained the right to refuse US entry visas to the Russian officials it believes to be responsible for the death of Sergey Magnitsky while in detention Under the Immigration and Nationality Act (INA), the Department is required to deny visas to individuals involved in human rights violations, such as torture and extra judicial killings, aState Department official told Interfax Certainly, the Russian diplomatic mission will give its tough assessment to this decision, when we receive its formal confirmation, ù Slutsky said It could happen as early as today Slutsky said the Russian diplomatic community understood that the move by the US is a provocation, ù that unfortunately finds support among high governmental circles in the West, and primarily in the US proper We must not yield to provocations, ù he stressed, while saying that Russia must give the toughest possible, but measured response The First Deputy Head of the Duma Committee for International Affairs then mentioned the Russian US reset, put into motion by Russian President Dmitry Medvedev and his American counterpart, Barack Obama, which could be jeopardized by Washington s gamble Such actions by the U S State Department, if formally proved, conflict with the reset process in the U S Russian relations, he said At the same time, Slutsky noted that cooperation between Russia and the US is growing, and as damaging as the American actions may be, would probably not succeed at reversing current tendencies Of course, this reset is haphazard, but it is still proceeding, and as the chairman of the Russian peace foundation I can confirm: the constructive cooperation between the two countries civil societies is growing, Slutsky acknowledged He then warned of the dangers of allowing certain politicians to disrupt this process At times, even less significant events led to all sorts of cold and hot wars Under no circumstancesshould we allow a disruption of the reset in the relations between our countries, Slutsky said It is vital that we temper our words and actions so as not to wreck the reset process, thus taking our countries back to the threshold of the Cold War he continued Robert Bridge, RT Read related Vyacheslav Nikonov s column here   ",https://www.rt.com/russia/us-visa-russia-reset-washington-moscow/
"20 Mar, 2011",Obama tarnishes Nobel Peace Prize with ‚Äúindiscriminate‚Äù military action in Libya,"Moscow harshly condemns an international military operation against forces loyal to Libyan leader Muammar Gaddafi, while Washington downplays its role in the hostilities It has taken US President Barack Obama just over one year and less than that if we consider that he earlier agreed to keep open the Guantanamo Bay detention facility † to damage his Nobel Peace Prize, awarded in Oslo, Norway in October 2009 On Saturday, US warships unleashed a massive sea based missile salvo against targets inside of Libya, where Col Muammar Gaddafi has been engaged in a desperate showdown against anti government forces The battle is largely centered on the city of Benghazi, where oppositional forces have announced an interim Libyan government ù US warships and submarines fired more than 110 Tomahawk cruise missiles into Libyan territory to disable air defense systems, allowing French and British fighter jets to more easily enforce a no fly zone The attack on Libya marks the third Muslim country that the United States is now engaged in military operations with So much for sitting down and talking with enemies, as Obama promised to do during his political campaign for the US presidency It should be no surprise that Washington is going out of its way to disassociate itself from the Libyan military campaign, or at least the leadership part of it We did not lead this, ù Secretary of State Hillary Rodham Clinton told a gaggle of reporters in Paris over the weekend We did not engage in unilateral actions in any way, but we strongly support the international community taking action against governments and leaders who behave as Gaddafi is unfortunately doing ù †Observers say Washington s reluctance to advertize its hefty contribution in the military operation suggests that the Obama administration, already under attack inside of its own party for towing the Bush line, ù is an attempt to deflect hostility from the Muslim world, not to mention Main Street, U S A , which certainly cannot afford to foot the bill for yet another overseas adventure They [the Obama administration] really want this to be a short, jolly operation, ù remarked a senior British defense analyst, who asked not to be identified due to his position But all the bets are off on this one Nobody is quite sure what the allied forces will be able to accomplish [in Libya] over the long haul ùIncidentally, Saturday s attack also marked the eighth anniversary of the start of the Iraq War, begun by Obama s predecessor, George W Bush Russian officials have slammed the US missile attack, while calling on the international coalition to stop the indiscriminate use of force ù it says has killed civilians Foreign Ministry spokesman Alexander Lukashevich said the air strikes exceed the mandate of the UN Security Council resolution, which approved a no fly zone and authorized all necessary measures to protect civilians We are emphatically urging the coalition states to stop indiscriminate use of force, Lukashevich told reporters, according to Interfax We are firmly convinced that the mandate deriving from Resolution 1973 of the UN Security Council, which was adopted as a rather controversial step, cannot be used for attaining goals going clearly beyond its provisions, spelling out measures solely intended to protect civilians, he said As Operation Odyssey Dawn ù kicked off on Saturday, missile strikes delivered on Libya also hit non military facilities in the capital of Tripoli, as well as in Tarhuna, Maamur and Jmeil, Lukashevich said, before providing a grim picture of the attack s collateral damage As a result [of the missile strikes], 48 civilians have been killed and over 150 wounded, ù Lukashevich revealed A medical center has been partially destroyed and roads and bridges have been damaged ùRussia announced Sunday that it was evacuating some of its diplomatic staff and other citizens from Tripoli Meanwhile, Liberal Democratic Party leader and State Duma Vice Speaker Vladimir Zhirinovsky has described the coalition forces military operation against the Gaddafi regime as pure aggression, ù while calling for a new Nuremburg ù Shame on NATO and all the murderers and barbarians, ù the Russian firebrand told media on Sunday All of these rogues will be brought to account one day The aggressors will get their due for the numerous crimes committed at an independent international tribunal, in a new Nuremberg trial ùThe UN Security Council voted on Thursday to impose a no fly zone against pro Gaddafi forces, which has been accused itself of using inordinate force against anti government forces Russia and four other council members † China, Germany, Brazil and India † abstained from the vote According to Gaddafi, Tripoli regards the West s military operation against Libya as an unlawful invasion of a sovereign state and sees it as nothing else but an act of terrorism Speaking on Libyan television, Gaddafi said that the United States and Europe had proven to the world that you are not civilized, that you are terrorists † animals attacking a safe nation that did nothing against you ùLibya, incidentally, is ranked as one of the top ten biggest oil producers in the world Robert Bridge, RT   ",https://www.rt.com/russia/libya-russia-military-force/
"5 Feb, 2011",Russia and US get STARTed,"The new Strategic Arms Reduction Treaty between Russia and the US has fully come into force after Russia s Foreign Minister and the US Secretary of State exchanged ratified and signed documents Following the ceremony, Russian Foreign Minister Sergey Lavrov announced that the New START treaty has taken effect in the form it was signed by the presidents of the two countries Even though the two sides had made so called special statements or recommendations, they will not affect the actual implementation of the deal The original text remains untouched Russia and the US eventually manifested their responsibility for security in the world and their readiness to continue moving towards stability, Sergey Lavrov said We have many plans and we will try to implement all of them † I would like to underline that the START treaty [is in] the national interests of both the Russian and American people, ù he added It favors nuclear non proliferation and disarmament ùHillary Clinton said that in the course of 45 days, Russia and the United States are due to exchange complete information about their nuclear arsenals † She added that within 60 days the sides are due to resume mutual inspections Clinton observed that the countries have managed to attain visible progress in the reset ù process † † Two years ago we all laughed about the translation of the ceremonial reset button that I gave to the foreign minister in Geneva, but when it came to the translation that mattered most, our two countries, led by our two presidents, turned words into action to reach a milestone in our strategic partnership, ù she said Sergey Lavrov and Hillary Clinton met on the sidelines of the international 47th Munich Security Conference which they were both attending The documents they exchanged were earlier ratified by the parliaments of both countries after heated debate The US Senate backed the treaty in December 2010 Before ratification, American legislators amended the treaty, securing Washington s right to modernize its remaining nuclear arsenal Another statement stipulated that the treaty should not obstruct US defense plans in Europe Before giving their approval to the START treaty, the Russian State Duma also made several amendments to the document One of them suggests that Moscow can back out of the treaty if it feels that US missile defense plans in Europe pose a threat to Russia s national security The new treaty will obligate the two countries to cut their atomic arsenals by a third and will regulate military nuclear relations between Russia and the US for the next ten years, with a possible five year extension option It was originally signed by presidents Dmitry Medvedev and Barack Obama on April 8, 2010 in Prague Nuclear disarmament campaigner Kate Hudson said that the New START treaty is a very important factor in the global trend away from nuclear weapons The fact that the two biggest nuclear powers are engaged in a disarmament process must surely encourage other countries not to go down that route themselves, not to go down the nuclear proliferation routes, ù she said I think as an indication of the way the international community is moving on nuclear weapons, this is very significant indeed and of course, the way is open for the United States and Russia to pursue further bilateral reductions, ù Hudson added Kommersant newspaper political analyst Sergey Strokan believes that the New START is sending a powerful message to the world community When we discuss the importance of the START treaty, we have to understand that it is not only the deepest cuts of nuclear weapons in world history, ù he said ùThe treaty is definitely an important political and psychological message, a message to the world powers that nuclear weapons are obsolete, they do not fit into the defense strategies of the world powers They have to cut them ùStrokan added that getting rid of nuclear weapons will make the US and Russia stronger † Definitely, it will make them stronger because it envisages not only cuts of nuclear weapons but also both sides would have to undergo modernizing of their potential, ù he said That is why their military force will be more up to date ù Professor of politics at the University of Kent, Adrian Pabst, told RT that the new treaty is a practical step toward genuine reset ù between Russia and the United States † † It is a confidence building measure The reset has often been dismissed as just nice rhetoric with little action, but now we have a concrete outcome of the reset in US Russia relations and I think that both sides want to build on this, ù he said Yury Rogulev from the Franklin Roosevelt Foundation of US Studies said that hopes are high that other countries will follow the example of the United States and Russia † The importance of this agreement is the example to the other countries, ù he said First of all, to those countries that do have nuclear armaments and to those countries who do not agree to join the non proliferation movement This agreement between the United States and Russia, I think, would promote the non proliferation process and would help to include other countries to the process of arms reduction ù   ",https://www.rt.com/news/russia-us-start-ratified/
"1 Feb, 2011",Remembering Yeltsin,"For many westerners, memories of Boris Yeltsin are filled with images of a fun loving, unpredictable and occasionally reckless individual who in some ways was the very personification of Russia itself Boris Yeltsin, the first President of the Russian Federation, was unlike any other leader of modern times Dancing on stage with girls during a live musical performance on Red Square; causing former US President Bill Clinton to convulse in a fit of uncontrollable laughter at the podium; standing on top of a tank at the height of the Soviet attempt at a coup d √©tat, exposing himself to the gravest danger These are just a few of the many indelible memories left behind by the man who almost singlehandedly brought down the sprawling Soviet Union According to Nikolay Svanidze, Yeltsin gave Russia stability, the Constitution, democratic government, free market economy and free press This is enough to recognize Yeltsin as a prominent and definitely positive historical figure, albeit a controversial one For Russia, Boris Yeltsin was the right man at the right time, and the time was certainly ripe for the epic collapse of an empire like Rome that was suffering from imperial overstretch and bankruptcy Although there are vastly differing opinions about Yeltsin, and the role he played in Russian history, historians are practically unanimous in the belief he helped to initiate the dissolution of the Soviet Union with the minimal amount of violence and loss of human life This achievement in itself is enough to immortalize Yeltsin in the annals of world history Indeed, nobody in the West could have predicted that such a massive and powerful regime as the Soviet Union would one day implode with little more than a whimper In a series of remarkable events, which seemed to western observers at the time as nothing more than cosmetic reforms as opposed to the epic changing events they were becoming, Yeltsin quit the Communist Party in 1990; in June 1991 he emerged victorious in Russia s first direct, popular elections for the presidency Then, during a dramatic coup attempt to overthrow Gorbachev in August 1991, Yeltsin never lost his nerve He organized a nearly bloodless resistance of democratic forces in Moscow against the hard line communist challenge, thus emerging as the country s most powerful politician It is one thing, however, to topple a government † indeed, an empire † but a completely different thing to transform an economy And that was the awesome challenge that faced Yeltsin and the Russian people following the collapse of communism and the embrace of free market capitalism Suddenly, overnight, Russia was consumed by a privatization spree, with factories, companies and even the nation s vast natural resources falling under the control of a handful of tycoons The quest for power and profits in the 1990s became the modern equivalent of Russia s past Time of Troubles ù They have also been rightly compared to America s gangland hits of the Roaring 1920s On the streets of Moscow and beyond, contract killings were occurring in broad daylight, while corruption was rampant Meanwhile, Yeltsin was starting to attract public criticism as the Kremlin was falling under the sway of a tightly knit group of economic and political insiders known as The Family ùDespite Russia being ravaged by this complex cocktail of economic, political and social ills, Yeltsin managed to beat off a challenge by the leader of the Communist Party Gennady Zyuganov in the 1996 presidential election Yeltsin managed to attract 53 percent of the vote to Zyuganov s 40 percent in a runoff election Yeltsin, however, recovering from two heart attacks, was now entering the most challenging moments of his dual presidency Not only was Russia s transformation to a free market economy becoming increasingly chaotic (on August 17, 1998, Russia experienced a severe financial crisis as the ruble collapsed, wiping out the savings of ordinary Russians, while destroying thousands of businesses), but the hot coals of war in Chechnya under Yeltsin (Dec 1994 to Aug 1996) were starting to rekindle The last years of Yeltsin s presidency were spent reshuffling the government as four premiers came and went In 1999, the State Duma even attempted to impeach Yeltsin, claiming that he had encouraged the breakup of the Soviet Union in 1991, among other charges This political setback was followed by a wave of bombings that hit four apartment buildings in Buynaksk, Moscow and Volgodonsk, which left 293 people dead, 651 wounded and the country badly shaken By this time late in his political career, Yeltsin, ever the captain of his own destiny, understood better than anybody that events were moving beyond his ability to control them In yet another surprise move that caught the world unawares, Russia s first president announced his resignation on December 31, 1999, ushering the way for Vladimir Putin In hindsight, Yeltsin s final act as president of Russia has been a resounding success: Under Putin s dual presidency, the Kremlin cleaned its corridors of the tycoons who were complicit in the collapse of Russia s economy; the uncertainty over Chechnya has dramatically decreased albeit it at a high human and material cost; Russia has returned to the center stage as a respected global player a little over two decades following the near fatal collapse of the Soviet Union Although part of the reason for Russia s triumphant return from the edge of the abyss is its wealth of natural resources, this explanation only partially explains the turnaround, while failing to appreciate what could be best described as smart, pragmatic politics on Putin s watch That tradition now continues under President Dmitry Medvedev, where Russia continues to develop its economic, social and political infrastructure in pragmatic fashion The legacy of Boris Yeltsin carries on, and Russia is certainly the better for it Robert Bridge, RT   ",https://www.rt.com/russia/boris-yeltsin-russia-anniversary/
