date,title,content,URL
"8 May, 2019",Trump Strangelove: Or how America learned to worry and hate Empire,"President Donald Trump seems to be making Americans hate the empire again, by embracing war or maybe only pretending to do so against Iran, Venezuela, Cuba, North Korea and who knows where else One thing to keep in mind about Trump is that his critics tend to instinctively oppose anything he is for, regardless of what they may have thought in the past Take this video, for example, comparing the eerily similar rhetoric behind George W Bush s push for war against Iraq and the Trump administration s current drumbeat for war with Iran, featuring Secretary of State Mike Pompeo, National Security Advisor John Bolton, and Trump s personal attorney Rudy Giuliani Trump is pushing us toward the brink of war with Iran î and it all sounds alarmingly familiar pic twitter com/iLv7Rd8bXL The twist? It was produced by MoveOn org, a Democrat activist group set up in 1998 to oppose the impeachment of President Bill Clinton, and bankrolled by George Soros These are the same Democrats, mind, who did nothing to oppose Clinton s 1999 war on Yugoslavia, Obama s 2011 intervention in Libya, or the actual Iraq War for that matter But now they warn against war with Iran because Orange Man Bad! Recall, however, that Trump himself has repeatedly denounced the Iraq War and indeed, used that to bludgeon Jeb Bush during the 2015 Republican primaries, obliterating the candidate the establishment and media thought would be the front runner Then, in 2016, Trump delivered a blisteringforeign policy speechdenouncing nation building and wars of conquest around the globe in favor of America first ù Oh, the establishment in Washington wailed and gnashed their teeth, but took comfort in the knowledge that Trump could never, ever possibly be elected Every single media outlet told them so, after all And then it happened anyway Netanyahu and Trump are gearing up for Bolton s mustache with Iran, and we re all screwed pic twitter com/PIpbvm5828 When the unthinkable happened later that year, the establishment launched every possible effort to resist ùand sabotage Trump s agenda, primarily by the means of the Russiagate conspiracy theory The very Swamp ùin Washington that Trump vowed to drain went to war against anyone who might actually do it from General Michael Flynn onward while steering clear of neocon cadres like Pompeo, Bolton,Kurt VolkerorElliott Abramsthat ended up working for Trump Have you seen any of them accosted at a restaurant, or accused of a scandal in the Washington Post? Of course not This is one possible explanation for why Trump ended up embracing the neocons: they are the only ones actually willing to work in his administration Another possibility, however, is that Trump is aware the very best way to make the establishment hate a position is for him to embrace it Justin Raimondo of Antiwar com, who has watched US foreign policy closely for the past 25 years, is convinced that Trump has embraced the neocons in order toset them upfor a defeat, letting Pompeo and Bolton along with others freely indulge their fantasies of regime change in Caracas or a counter revolution in Tehran, as a way to prove his point that the American Empire he condemned in 2016 is untenable We can see the knife go in as this whole scenario plays out, ùRaimondowrote in February, as Trump embraced regime change in Venezuela Perhaps that sounds a bit too Game of Thrones , but look at what has actually happened since: each attempt by US backed interim president Juan Guaido to take power has failed more spectacularly than the previous one Also note that one of the loudest voices for regime change in Venezuela and a harder line on Cuba, Senator Marco Rubio (R Florida) repaid Trump by voting against his declaration of emergency on the US Mexico border, invoked to overcome Democrat opposition to the border wall I do question Bolton and his motives, and I do NOT want any more wars I struggle with the fact that Trump has Bolton, a well known NeoCon, in this position https:// tdotco /d3g0dIcSOB Recall how the very same media outlets that hounded Trump with the now debunked Russiagate conspiracysang praisesto the beauty of our weapons ùwhen the president fired off some missiles into Syria, to ensure he stays the Assad must go ùcourse While the State Department rhetoric on that has not changed, Trump did order US troops out of Syria and that actually happened,more or less, suggesting that Washington has tacitly given up on regime change in Damascus Of course, this could all be Q level speculation about 4 D chess ùIt is entirely possible that Trump has simply been seduced by the neocon siren call of perpetual war and the American Empire, despite consistently expressed beliefs to the contrary over a long period of time If there is one thing that s been absolutely certain about the Trump presidency so far, it s that the only way to know for sure is to see what happens Nebojsa Malic, for RT ",https://www.rt.com/op-ed/458688-trump-neocons-iran-venezuela/
"6 Nov, 2018","‚ÄòThey came in the same old way‚Äô: In the midterms, echoes of 2016","The 2018 US midterm elections are shaping up to be not just a rematch of the 2016 presidential race but a rerun, as Democrats and the media seem determined to repeat the same mistakes that produced the presidency of Donald Trump Just look at the headlines,the polls, and the talking heads on television Doesn t this remind you of 2016? Once again, celebrities and late night show hosts are beseeching their fans to vote, while newspapers pen fawning pieces about Democrats making history, ùthe inevitability of the Blue Wave, ùand theracist, racist, RACISTnature of every Republican ever, especially Trump Vote like the authoritarian president is a racist sexual predator who colluded with Russia and won t show his taxes and violates the emoluments clause and incites nazi terrorism but the GOP is complicit and the media is distracted so it s up to us to save the god damn country The only thing that has changed is that most media outlets which had overwhelmingly endorsed Hillary Clinton in 2016 don t even bother hiding their preferences Everything is out in the open now, stripped of all pretense and posturing Ironically, that is one of the effects of the Trump presidency Much like the armies that are always studying how to re fight the last war, US politicians appear to be obsessed with re fighting the last election Both major parties see the 2018 midterms as a rematch of 2016, but for different reasons Democrats are hoping that Trump s victory was a fluke, a glitch in the matrix, and that their inevitable march to power will be put back on track Trump s Republicans, however, believe that 2016 was a revolution in political affairs and that their tactics will work once again The most important election ever ùis a worn out cliche, but these midterms are not your usual election That s evidenced by thesheer amount of moneyspent on them, a record $5 billion Yet it is worth recalling that in 2016, Clinton both outraised and outspent Trump, to no avail They had learned nothing and forgotten nothing, ùis a quote attributed to a famous diplomat from over 200 years ago, about a French royal dynasty It applies just as well to the American political dynasties the Clintons and the Bushes and their coteries, deposed by Trump in 2016 What they did not realize then, and do not appear to realize even now, is that their tried and tested tricks simply didn t work against Trump, who is not a professional politician and doesn t react like one Love him or hate him, agree with his policies or not, this is a fact Rather than recognize that fact and deal with it accordingly, Trump s critics just stuffed more wool into their ears and continued screaming RACIST, ùas if that invocation was somehow magical It is this sort of magical thinking that doomed the Democrats in 2016 It wasn t just bad data, or a terrible job interpreting it, but the fact that both the media and the Clinton campaign wanted to believe their own hype Instead of reporting reality, the media thought they couldcreateit So they pretended the railroading of Bernie Sanders did not happen, and confidently predicted Clinton would crush Trump Then came the night of November 8 and the shocked, stunned long faces in TV studios and at the Javits Center That right there was the perfect moment for self reflection, understanding what went wrong and where, and learning from it Instead, Clinton blamed Russia, and the media quickly followed suit The alternative would have been admitting they had made a mistake, after all Today, they argue that history shows the ruling party always loses the first midterms Fair enough, but history also shows the incumbent party going strong when the economy is good and by the standards accepted by the media, that s observably the case So what we get are headlines along the lines of Economy has never been better; This is why it s bad and also Trump s fault ù Remember it was Hillary Clinton who first used the phrase fake news ù? Yet it was Trump who flipped the script, so to say, associating the phrase mainly with CNN and other mainstream outlets, to their perpetual frustration It s not the first oronly attackthat s backfired Who can forget Hillary Clinton dismissing Trump supporters as the basket of deplorables racist, sexist, homophobic, xenophobic Islamophobic you name it ùand irredeemable ù? She also insisted that they are not America ùThat worked out so well, didn t it? Who, now, remembers Russiagate ù? Yet in the months after the 2016 election, the media spoke of little else, giving airtime and column space to every grifter who pitched a narrative about evil Kremlins ùsubverting our democracy ùwith Twitter ads, or something As details emerged about the origins of the Steele Dossier, its role in the spying on Trump s campaign and the text messages between FBI lovebirds entrusted with the task well, notice how the Russia ùstory has been conspicuously absent of late? Desperate to deny reality, Democrats and the media latched onto pipe dreams: the Hamilton electors ùwill fix it and vote for Clinton (they didn t); Trump will be impeached over emoluments ù(what?); the FBI will find Russian collusion ù(it didn t); special counsel Robert Mueller will force Trump s closest associates to flip ùon the president and Nixon the Orange Man right out of the White House Nope, nope, nope Didn t happen Instead of criticizing Trump s policies and there is plenty there to pick a fight with his critics settled into the mantra of Orange Man Bad ùThough it failed in 2016, they re betting the bank it will work this time They came in the same old way, and we saw them off in the same old way, ùis a quote attributed to the Duke of Wellington after defeating Napoleon at Waterloo As best as I can tell, it s apocryphal The actual Wellington described the battle as the nearest run thing you ever saw in your life ùWhich will the 2018 midterms more closely resemble? We re about to find out Nebojsa Malic ",https://www.rt.com/op-ed/443158-midterms-echoes-2016-democrats-media/
"21 Mar, 2018",Russian election: Western demonization of Putin has made him more popular in Russia,"Western leaders and opinion formers believed sanctions and economic pressure would encourage Russians to turn against Vladimir Putin They couldn t have been more wrong Bryan MacDonald is an Irish journalist based in Russia He has written for RT since 2014 Before moving to Russia, Bryan worked for The Irish Independent, the Evening Herald, Ireland on Sunday, and The Irish Daily Mail Follow him on Twitter@27khv Bryan MacDonald is an Irish journalist based in Russia He has written for RT since 2014 Before moving to Russia, Bryan worked for The Irish Independent, the Evening Herald, Ireland on Sunday, and The Irish Daily Mail Follow him on Twitter@27khv If you re not Russian, you probably haven t heard of Aleksey Pushkov He s an influential academic, politician, and media personality who once ran the Foreign Affairs Committee of the Duma (the lower house of the parliament) and is widely considered to be close to the Kremlin In the early hours of Monday morning, as the extent of Vladimir Putin s latest presidential victory became clear, he took to Twitter to make a very important point: western demonization of Putin inspires the opposite effect in Russia Instead, citizens rally around him And the election results confirm this ù Influential Russian politician & commentator Alexei Pushkov says western demonization of Putin causes the opposite effect in Russia Instead, citizens rally around him And the election results confirm this https:// tdotco /IPgDfW8Zsb Pushkov is correct Because Putin s latest landslide was partially made in the West To understand why, we need to rewind the clock to 2011 Back then, on the surface at least, Russia was doing well economically The ruble was trading around 30 to the US dollar and the price of oil was high While the country s reliance on the latter resource was always a poor long term strategy, it provided easy money And this meant Russians could afford to travel to places, and buy imported products, which Soviet citizens could only have dreamed of, two decades earlier Despite this, a considerable amount of people weren t happy And when the sitting president, Dmitry Medvedev, announced in September that he was stepping aside to support Putin s (who was serving as prime minister) return to the Kremlin, anger grew in some sections of society, especially the pro business and liberal factions You see, for them, Medvedev represented the promise of liberalization and westernization, and the return of Putin was seen as a step backwards towards nationalism, conservatism, and even authoritarianism In December, the Duma election took place, with United Russia, the party associated with Putin and Medvedev, failing to win a majority of the vote Some alleged the contest had been falsified and the party s real share was even smaller READ MORE:America s elite thinks it has a divine right to rule the world As a result, protests kicked off, largely centered in Moscow But there were also demonstrations in many provincial cities, including Khabarovsk, more than 8,000km from Moscow, where I resided at the time At this moment, one thing was very clear: many Russians sought a new sense of identity, and the various post Soviet factions were heading for a showdown One which took place over the following months In December, the Western media had decided to christen the unrest as the Snow Revolution , amemewhich conjured memories of similar events in Ukraine and Georgia, labelled Orange and Rose respectively And this was a serious error because Russians weren t looking for the overthrow of their state And, at least in the heartland, many feared a return to the anarchy of the 1990s Thus, while certain capital city circles sizzled with talk of revolution, where I was living, people seemed horrified by the very idea This is the rich Moscow elite marching, these guys have nothing in common with me, ù was a typical statement While others seemed to think the protestors were ungrateful, because, after all, their very prosperity was mostly down to Putin, who had inherited a basket case economy in 2000 and greatly improved living standards Nevertheless, things became very tense for a while, with no less a figure than Mikhail Gorbachev publiclycallingfor Putin to resign † Of course, Putin didn t heed Gorby s call Instead, he continued his presidential campaign and in March 2012, won handsomely, with a score of 63% nationally, but only 46% in Moscow Now, this is where I need to explain something: the 2011/12 protests were, more or less, a big smoke ù phenomenon And it explains † why Western media correspondents, who are all based in Moscow and have little understanding of the rest of Russia, beyond itsoccasionalnovelty value, made their readers and viewers believe something substantial was stirring when the reality was less dramatic Because, in a place like Khabarovsk, the movement gained no traction beyond a bit of muttering in cafes and between close family and friends Putin realized this and learned a lesson In his first two terms, he d probably spent too much time worrying about the Moscow elite From now on, he was going to focus on his base, the ordinary folk who keep Russia working And little did he know at the time, but the West was about to lend a helping hand The KremlinbelievedHillary Clinton had interfered in Russia s 2011/12 unrest, but her influence was limited, even if Putin s team regarded it as a betrayal However, America s behavior in Ukraine in 2013/14 was another matter entirely This was the US openly intervening in street protests in Russia s neighbor and Clinton s former assistant secretary of state,Victoria Nuland, was leading the charge eventually even going so far aschoosinga new government in the aftermath For Russians, it was incredible Ukraine, home to entire regions where ethnic Russians constitute a significant majority, was, as they saw it, being destabilized in a Western backed coup Something which meant that Crimea, part of Russia for hundreds of years until Nikita Khrushchev signed it away in the 1950s, could have feasibly wound up housing NATO bases Thus, when Putin decided to reabsorb the peninsula in the spring of 2014, his popularity ratings reached unprecedented levels Because Russians believed the West had betrayed them And, since then, the EU and the US have played into his hands Russians are fully aware of Western scaremongering about their country and the demonization of their president They see it on news sites, across social media, and on TV And the ones who can t understand English can even read Russian translations of the Western press on a dedicated website, Inosmi (which, incidentally, is state funded) Furthermore, in addition to the constant barrage of media delirium, the NATO countries sanctions policy has created a besieged fortress mentality in Russia Indeed, Andrey Kondrashov, Putin s campaign spokesman, summed this up on Sunday night Turnout is higher than we expected, by about 8 10 percent, for which we must say thanks to Great Britain, ù hesaidwith tongue surely in cheek, referring to the fallout from a spy poisoning drama in the UK We were pressured exactly at the moment when we needed to mobilize [voters] Whenever Russia is accused of something indiscriminately and without any evidence, the Russian people unite around the center of power And the center of power is certainly Putin today ù In 2012, Putin was under pressure in Moscow, but this weekend he secured over 70% of the vote in thecapital And in St Petersburg, where he managed 58% six years ago, he can now boast a 75% score And it has happened at a time when Russians have endured a deep recession, with falling real wages, during a painful, but necessary, economic restructuring after the previous resource driven model exhausted itself Today, even liberal, educated, and cosmopolitan dwellers of the two big cities generally support the status of Crimea and now resent the West for its anti Russia hysteria Whereas in 2011 12, many saw the US as a country to aspire to, now they are disappointed with Washington and believe the US to be fundamentally opposed to respecting any of Russia s vital interests READ MORE:Putin s landslide victory to attract additional $30bn to Russian economy Thus, ironically, a Western policy aimed at weakening Putin and reducing Russian resolve has completely backfired Eighteen years after he first entered the Kremlin, the president s position has never been stronger, or more secure And he can thank the dysfunctional and self destructive policy of the United States and the European Union A lot of which is influenced by too much reliance on Russia experts ù who don t really understand the country at all And it shows",https://www.rt.com/op-ed/421944-putin-election-demonized-west-victory/
