date,title,content,URL
"24 Oct, 2018",False flags or MAGAbomber? Explosive devices sent to Democrats divide America,"What do the Clintons, Obamas, Debbie Wasserman Schultz, George Soros, Maxine Waters and CNN have in common? They re all outspoken critics of President Donald Trump, and recipients of pipe bomb packages Is there a connection? A pipe bomb was delivered to the CNN headquarters in New York City on Wednesday morning It was addressed to former CIA chief John Brennan who is actually a MSNBC pundit and had the return address of Rep Wasserman Schultz The envelope had insufficient postage, and misspelled Brennan s name and Florida Photos show a rudimentary pipe bombhttps://tdotco /jBGDqjvBXv The former DNC chair Schultz s office in Florida received a similar device So did the congressional mailroom in Maryland, addressed to Rep Waters (D California) Another was sent to the home of former President Bill Clinton and his wife Hillary in Chappaqua, New York and Barack and Michelle Obama s residence in Washington, DC READ MORE: Mailbomb blitz: Packages sent to Obama, Soros, CNN, Clintons & others New York City Mayor Bill deBlasio and New York Governor Andrew Cuomo called the packages an act of terrorism ùat a press conference on Wednesday, placing them squarely in the context of the upcoming midterm elections Leaders of Democrats in Congress, Sen Chuck Schumer (D New York) and Rep Nancy Pelosi (D California)blamedTrump s statements that condone acts of violence ùand attack the press CNN president Jeff Zucker alsolashed outat the White House, denouncing Trump s continued attacks on the media Democrat activists were quick to blame Trump and claim this was the work of his supporters, coining the hashtag MAGAbomber ù Every single recipient of the bomb packages î Soros, Obama, Clinton, Wasserman Schultz, Holder, CNN î has been a target of Trump s vicious comments at his raucous rallies He didn t light the fire, of course, and he s condemning it, but he brought the kindling and the matches #MAGAbomberis literally going down Trump s list of enemies that he spews about at every rally https://tdotco /Fpb1I6pcfu Maxine Waters! The#MAGABomberis playin all of Trump s Greatest Hits https://tdotco /tG99nrx0R6 It s despicable that certain Right wing personalities on Fox News, are pushing the idea that Democrats could be behind the bombs sent to the Clintons and others #bombscare#MAGABomber Since every normal, peaceful muslim is forced to personally disavow all terrorist attacks from Islamic extremists, today s a good day to harangue every Trump voter you know into condemning and apologizing for the#MAGAbomber s actions Some conservative commentators countered by saying that the timing of the bomb scare just two weeks before the contentious midterm elections suggested a Democrat play for sympathy, and that the vast majority of violent incidents over the past two years were aimed against Republicans When you watch: Scalise shot GOP pols harassed Holder say kick em Obama say throw them out Hillary say only civility if Dems win Waters say harrass Trump supporters Antifa beating peopleIt s only logical to question who actually sent the bombs The fact that#MAGABomberis trending with not a shred of evidence is indicative of the deranged times we live in 6 bombs sent to Democrats 0 go off All crudely made pipe bombs and conspicuously obvious explosives, and all easily screened and discovered Stunt seems designed for maximum political/media optics, not maximum damage Assuming we ll know the identity of the bomber within 24 hours IF it s in fact a Trump supporter, YOU KNOW the media will be all over the story, and show the perps face everyday until Nov 6IF it s the other side, my guess is theyll cover up the identity Stay tuned I guess Hillary Clinton, who was in Florida, was quick to make political hay out of the suspicious packages, saying that America is divided and we have to do everything we can to bring our country together ù by electing Democrats, of course She conveniently forgot her own argument against civility towards Republicans, aired onCNN earlier this month Earlier in the day, the New York Times ranan op ed by Alexander Soros, son of the billionaire mega donor funding the Democrats in the US and like minded parties in Europe and elsewhere Decrying the explosive that wassent to his father s New York residenceearlier this week, Soros blamed Trump and called for a Democrat victory in the coming midterms: We must find our way to a new political discourse that shuns the demonization of all political opponents A first step would be to cast our ballots to reject those politicians cynically responsible for undermining the institutions of our democracy And we must do it now, before it is too late ù President Trump and his family have condemned the bomb packages as cowardly attacks ùand despicable acts, ùwith Trump promising to bring the full weight of the government ùto bear on those responsible In these times we have to unify, we have to come together and send one very clear, strong, unmistakable message that acts or threats of political violence of any kind have no place in the United States of America, ùhe said at the White House on Wednesday afternoon I strongly condemn the attempted acts of violence against President Obama, the Clinton family,@CNN& others There is no excuse îAmerica is better than this Gratitude to the@SecretServiceand law enforcement for all they do to keep this nation safe As someone who has been on the receiving end of threading packages, I can tell you how disgusting these acts are! America is better than this These acts should be condemned by all and I hope they throw any individual caught in jail, for a very long time I agree wholeheartedly!https://tdotco /ndzu0A30vU It is difficult to tell whether the suspicious packages are the work of an individual or a group, retired US Marshal Matthew Fogg told RT However, if there are multiple perpetrators, the authorities will have an easier job tracking them down, because odds are greater that somebody s going to make a mistake ù Former CIA officer Philip Giraldi was more skeptical, saying that tracking down the would be bomber will be very difficult, unless they were dumb enough to include fingerprints on the bombs or in the packaging ù The authorities will be looking at small details that laymen usually don t even notice, Fogg said He believes evidence resulting from the investigation will be definitive enough to satisfy the public The packages might be an attempt to create negative sentiment against right wing groups just before the election to create some kind of shift to the left, but there is no evidence of that, ùGiraldi told RT And I don t think it would be successful, ùhe added, as most people complaining about the bombs are committed progressives who are already on board to hating Trump and his supporters ù ",https://www.rt.com/usa/442185-magabomber-democrats-midterms-soros/
"24 Oct, 2018","Mailbomb blitz: Packages sent to Obama, Soros, CNN, Clintons & others","In the last 48 hours, explosive devices have been sent to the homes and offices of numerous high profile Democratic political figures, as well as CNN s New York office The seemingly ever growing list of targets includes former President Barack Obama, former president Bill Clinton and former secretary of state Hillary Clinton, top Democratic donor George Soros, former DCCC chief and Florida congresswoman Debbie Wasserman Schultz and CNN s New York offices Speaking at an NYPD press conference, New York Mayor Bill De Blasio said that the events of the day were clearly an act of terror ùan effort to terrorize leaders of this country through acts of violence De Blasio said New Yorkers could rest assured ùthat the NYPD are out in force ùto protect the city He also blamed an atmosphere of hate ùtaking over in the run up to the midterm elections READ MORE: †IMAGES of the mail bomb sent to CNN, Twitter points to ISIS flag on it Here s what we know so far about the mailbomb blitz On Tuesday, police said theydestroyeda suspected explosive device found at the New York residence of Hungarian American billionaire and major liberal donor George Soros A team was sent to the residence after an employee of Soros opened the package at around 3:45 pm on Monday and found a device which looked like a pipe bomb, but police said that there was no threat to public safety READ MORE: †Explosive device found near Soros NY home report Soros is a major Trump critic and donor to the democraticparty While he has accused Trump of aiming to build a mafia state ùin the US, Trump has returned fire, accusing him of fuelling public unrest in the US, including protests against the confirmation of Supreme Court Justice Brett Kavanaugh I am truly grateful for the support of all who have reached out to inquire about the safety of my family after the attempted bomb attack Here s my op ed in the@NYtimesabout the incident and what is happening to politics in America today https://tdotco /9VALGi85yS In a New York Times op ed, Soros son Alexander blamed Trump and the politics of demonizing opponents for the bomb packages Alexander Soros wrote that the incidents were a threat to the future of American democracy ù News broke on Wednesday morning of potentialexplosive devicessent to the residence of former president Bill Clinton and former secretary of state Hillary Clinton in Chappaqua, New York î and to the home of former President Barack Obama in Washington, D C The Secret Service confirmed that the packages were intercepted and immediately identified during routine mail screening procedures and said the the Clintons and Obamas were never at risk of receiving them Later on Wednesday, CNN s newsroom in New York s Time Warner Center wasevacuatedafter a suspicious package containing a pipe bomb was found in the mailroom Around the same time, conflicting reports emerged of devices being sent to the White House, but those were not confirmed Video posted to Twitter showed evacuation alarms sounding behind CNN hosts on air Time Warner Center where CNN s New York offices are located was just evacuated The alarm went off as@jimsciuttoand@PoppyHarlowCNNwere on air reporting the packages sent to the Clintons and Obamas @ShimonProreporting it was over a suspicious package pic twitter com/EYBsytil0o JUST IN: Photo obtained by@ABCshows device recovered from CNN by the NYPD bomb squad https://tdotco /U4rVcvGxWWpic twitter com/NUo7PPGSGK CNN reported that the device was made with pipes and wires The NYPD later confirmed that an envelope containing white powder was also sent with the pipe bomb It also said that the device had been addressed to former CIA director John Brennan, care of CNN, with a return address of Congresswoman Debbie Wasserman Schultz s Florida office Wasserman s office also received a suspicious device later in the day The device sent to CNN was removed and placed in a bomb containment unit Police told NBC that all four devices sent to Obama, Soros, the Clintons and CNN are nearly identical CNN president Jeff Zucker has lashed out at the White House, denouncing President Trump s continued attacks on the media Statement from CNN Worldwide President Jeff Zucker:pic twitter com/OXyIT6oSLT Police on Wednesday also confirmed that they were investigating another possible suspicious package sent to the Sunrise, Florida office of Democratic Congresswoman Debbie Wasserman Schultz Footage online showed a bomb squad unit and firefighters arriving at the building, but it has not yet been confirmed that any viable device was found Breaking The Sunrise, Florida, office of Rep Debbie Wasserman Schultz has been evacuated after a suspicious package was found mailed there this morning, according to a spokesman for the police department Are is secured and the bomb squad is on site In the midst of the unfolding drama, the building which houses the office of Democratic Congresswoman Kamala Harris and the San Diego Union Tribune newspaper was also evacuated over the discovery of what was initially believed to be a suspicious package, but which turned out to be abandoned property From a San Diego Union Tribune reporter evacuated from the building after suspicious device foundhttps://tdotco /dwyCRRYLI5 UPDATE: San Diego police say the bomb scare at the Union Tribune newspaper building was a false alarm The packages were abandoned property In the latest reported scare, New York Governor Andrew Cuomo said that a suspicious device was also sent to his office in Manhattan and was being handled ùby the NYPD, but it was later confirmed that the package was not a bomb and was unrelated to the other incidents Capitol Police have also confirmed another suspicious device was intercepted at the Congressional Mail facility in Maryland, saying that it was addressed to Democratic Congresswoman Maxine Waters An NYPD official says the suspicious package ù at Cuomo s office was in fact just an informational package containing literature, per@soniamoghe https://tdotco /OZHihNXQTk President Trump and Vice President Mike Pence condemned the sending of the devices as despicable ùacts and said that the cowards ùresponsible would be found Speaking at the White House, Trump said a major federal investigation into the incidents was underway He said the country had to unify and come together and condemned acts and threats of political violence, saying they had no place in the US This egregious conduct is abhorrent to everything we hold dear and sacred as Americans, ùhe said, adding: We re extremely angry, upset, and unhappy about what we witnessed this morning ù I agree wholeheartedly!https://tdotco /ndzu0A30vU Statement on suspicious packages:pic twitter com/pYSbDvCvuk Online, speculation abounds as some pundits have been quick to pin the blame on President Trump, citing the fact that so far, all recipients of the potential explosive devices have been highly critical of his administration Others have suggested the bomb planting spree has been some kind of false flag intended to benefit Democrats in the upcoming November midterm elections @realDonaldTrumpwith every fiber of your rotten being you ve incited & condoned hate Never in 643 days have you discouraged people from unleashing the violence inside them Your very existence requires anger & fear You need it like normal people need oxygen This is on you Let s be clear about what is happening Someone just tried to assassinate five of Donald Trump s perceived political enemies:Hillary ClintonBarack ObamaFormer CIA Director John BrennanDebbie Wasserman Schultz George Soros These Suspicious Package stories are false flags, carefully planned for the midterms Michael Solomon, the former NYPD special investigator on the phone on CBS right now, just floated the theory that these bomb threats might be a false flag to distract the media from the Caravan two weeks before the midterms Just asking questions folks Why would a conservative pull off planting these bombs at this exact time and specific to the Clintons, Obama s, and CNN HQ?Either way and no matter your political affiliation, political violence of any kind doesn t do this country ANY good RT News App © Autonomous Nonprofit Organization TV Novosti ù, 2005 2021 All rights reserved This website uses cookies Read RTPrivacy policyto find out more ",https://www.rt.com/usa/442180-mailbomb-cnn-clinton-obama-summary/
"24 Oct, 2018",Mailed explosives ‚Äòan act of terror‚Äô - NYC Mayor,"New York City Mayor Bill de Blasio has said a series of mail bombs sent to prominent Democratic figures, including Bill and Hillary Clinton is clearly an act of terror ù Shortly after De Blasio condemned the attempted attack, New York Governor Andrew Cuomo said that a suspicious package had also been sent to his office, while Capitol police are reportedly investigating another package found in a Congressional mail facility in Maryland JUST IN: New York Gov Cuomo: A device has been sent to my office in Manhattan, which we were just informed about And that device has been identified and is being handled as we speak ùpic twitter com/BsJwrISqEx Earlier on, explosive devices were mailed to former President Barack Obama, the Clintons home in upstate New York, and to the Time Warner Center in New York City, which houses the CNN newsroom Additional reports of suspicious packages have seen evacuations take place at the offices of Florida Congresswoman Debbie Wasserman Schultz, California Senator Kamala Harris, and the San Diego Union Tribune newspaper NYPD commissioner James O Neill tells reporters that police are also investigating an envelope containing white powder that was discovered as part of the original packaging of the suspicious device found in CNN s NYC locationhttps://tdotco /4R1BQuBNPfpic twitter com/l9bBvq9geN Speaking about the package sent to CNN, De Blasio said that the incident was an attempt to undermine our free press and leaders of our country through acts of violence ù New York s police commissioner said that the package sent to CNN contained a live explosive and an envelope of white powder READ MORE: †Mailbomb blitz: Packages sent to Obama, Soros, CNN, Clintons & others The White House condemned the attempted violent attacks ùagainst public figures, and Vice President Mike Pence called the attempted attacks despicable ùPresident Trump did not issue his own statement, but retweeted Pence s message, adding I agree wholeheartedly! ù JUST IN: Photo obtained by@ABCshows device recovered from CNN by the NYPD bomb squad https://tdotco /U4rVcvGxWWpic twitter com/NUo7PPGSGK The mailbomb blitz comes days after an explosive device was found in the mailbox of billionaire liberal donor George Soros home in Westchester County, New York Law enforcement sources told the Washington Post that they believe Wednesday s packages are the work of the same person who targeted Soros on Monday The same sources told the Post that the bombs sent to Soros, Obama and the Clintons were all live pipe bombs placed inside plain brown envelopes with the addresses printed on stickers The bomber seems to have exclusively targeted figures from the democraticparty , and in Soros case, their supporters ",https://www.rt.com/usa/442167-nyc-mayor-act-terror/
"24 Oct, 2018",CNN newsroom in New York evacuated due to suspicious package,"Time Warner Center in New York, which hosts CNN offices, has been evacuated over a suspicious package report This comes a few hours after mail bombs were intercepted at Barack Obama s office and the Clintons home NYPD commissioner James O Neill said that the package contained live explosive device and an envelope containing white powder Police have intensified security outside offices of other media organizations in the city, however there s no indications that other facilities are at risk, according to the city s mayor The NYPD is investigating the package found at the Time Warner Center, CNN said, citing sources within law enforcement The network added that it evacuated its newsroom as a precaution ù We are being evacuated right now at time warner center in NYC Striking scene as alarm went off as@jimsciuttoand@PoppyHarlowCNNwere on air CNN New York was just evacuated Police everywherepic twitter com/yZLB6Cep0i The Secret Servicesaid earlieron Wednesday that bombs sent to the house of former President Bill Clinton and his wife Hillary in Westchester County, New York, and the office of former President Barack Obama in Washington, DC were intercepted during a routine mail check On Monday, a package containing an explosive devicewas foundnear the home of billionaire and democraticparty donor George Soros, located not far from the Clintons READ MORE: †Mailbomb blitz: Packages sent to Obama, Soros, CNN, Clintons & others CNN also reported earlier that a bomb addressed to the White House was intercepted, but this information was not confirmed officially The Time Warner Center is located at Columbus Circle in Manhattan near Central Park Police have cordoned off the area around the building #TimeWarnerCenter| Acordonan oficinas de@CNNy Time Warner Building por amenaza de bomba Esto ocurri√≥ despu√©s de detectarse artefactos explosivos dirigidos a@HillaryClinton,@BarackObamay@MichelleObama (@eSpaiNews)pic twitter com/jnLacrva2R According to CNN, the device was discovered in the mailroom of the Time Warner Center CNN bureau is evacuated in New York following the discovery of a suspicious device [24 October]#Fivosi#CNN#NewYork#NYPD#TimeWarnerCenterpic twitter com/OVihGnnQtT A bomb squad was deployed to the scene to remove the package, which was placed in a bomb containment unit on a truck Containment vessel for explosive device arriving Å¶@CNNnewsroom Å©pic twitter com/m0HPitADqi Explosive device in transit now in NYPD containment unit pic twitter com/Pt49kRm9UP The package was allegedly sent to 10 Columbus Circle, New York, NY 10019, USA, where the Time Warner Center is located, CNN reported, citing police sources Later, CNN said that the package was addressed to former CIA director John Brennan via the news network NYPD out in force outside@CNNstudios after a suspicious package forced the evacuation of Time Warner Center pic twitter com/RaXc4D4sW7 US Vice President Mike Pence condemned the attempted attacks ùagainst CNN, Obama and the Clintons, calling them cowardly ùand despicable ùactions Later, US President Donald Trump said he wholeheartedly ùagreed with Pence s condemnation of the incidents All the devices sent to Obama, the Clintons and CNN appeared to be pipe bombs, ùpolice said during a news briefing ",https://www.rt.com/usa/442145-%D1%81nn-newsroom-new-york-evacuated/
"23 Oct, 2018",Explosive device found near Soros' NY home ‚Äì report,"Police say they have destroyed a suspected explosive device found at the Katonah, NY residence of billionaire George Soros The bomb was reportedly found in the businessman s mailbox by an employee A bomb squad was rushed to the scene on Monday afternoon after the employee opened a package, revealing what appeared to be an explosive device, ùa Bedford Police Department official told the New York Times The FBI have announced that they are investigating the incident, but stressed that there was no threat to public safety We are conducting an investigation at and around a residence in Bedford, NY There is no threat to public safety, and we have no further comment at this time Soros, a Hungarian born political activist, philanthropist and hedge fund billionaire, has been a ferocious critic of US President Donald Trump, calling his presidency a danger to the world and the former real estate mogul a purely temporary phenomenon that will disappear in 2020 The heavyweight investor has alleged that Trump wants to establish a mafia state in the US, but won t be able to do it thanks to American law and its people Over the years, Soros has been pouring millions of dollars to the democraticparty s pockets The billionaire has contributed over $15 million backing the Democratic candidates in the upcoming mid term elections In July he told the New York Times that for every Trump voter there is more than one Trump enemy who will be more intent, more determined Trump has not been holding back either, accusing Soros of being behind the mass protests that marred the confirmation of Supreme Court Justice Brett Kavanaugh The president alleged that the protesters were paid by Soros and others to demean the reputation of Republican Senators, who overwhelmingly voted along party lines to confirm the divisive candidate The very rude elevator screamers are paid professionals only looking to make Senators look bad Don t fall for it! Also, look at all of the professionally made identical signs Paid for by Soros and others These are not signs made in the basement from love!#Troublemakers Soros has also been accused by some Republicans of funding a caravan of Honduran migrants that is walking through Mexico towards the US border BREAKING: Footage in Honduras giving cash 2 women & children 2 join the caravan & storm the US border @ election time Soros? US backed NGOs? Time to investigate the source!pic twitter com/5pEByiGkkN If you ",https://www.rt.com/usa/441986-soros-explosion-home-device/
