date,title,content,URL
"25 Oct, 2019",George Soros says all his ‚Äòenemies‚Äô are wannabe dictators as he drops unprecedented wads of lobbying cash,"In the world of billionaire financier George Soros, his critics are would be dictators ù who will not succeed Meanwhile, under Trump, the Open Society founder has been pouring greater sums into lobbying than ever before I m very proud of the enemies I have, ù he told the New York Times in an interview published Friday, in which he confidently predicted the popular opposition to his globalist philosophy was winding down and that a backlash against Trump style nationalism was on the horizon It s a perfect way to tell a dictator or a would be dictator, if he identifies me as an enemy Soros slammed the US president as an aberration, ùpredicting what he has done in the Middle East ù clearing troops from the Turkish Syrian border, allowing peace to break out with a deal between Russia and Turkey will contribute to his demise next year ù Trump has called out Soros in the past, accusing him of paying the protesters who swarmed the Capitol over Justice Brett Kavanaugh s nomination to the Supreme Court and hinting that he was bankrolling the migrant caravans that swarmed the US southern border last year Soros is a popular villain among conservatives, who suspect that, after funding colorrevolution s in Serbia, Georgia, Ukraine, and elsewhere, he is trying to start one in the US The currency speculation that has made him enemies from Malaysia to Britain has also made him rich enough to contribute billions toward funding what are usually described as progressive causes ù through his Open Society Foundations And he is spending more than ever on those causes, dumping some $15 9 million to influence Congress in just the third quarter of 2019 via his foundation s lobbying division, the Open Society Policy Center, according to a recent filing It s a jump even over the group s 2018 expenditures, which, at $31 5 million, made it the third largest lobbying group that year Only the US Chamber of Commerce and the National Association of Realtors outspent the billionaire Aside from lobbying, Soros spreads his money around liberally in more ways than one He has funded media organizations like Democracy Now! and Media Matters, pro immigration groups like the National Immigration Law Center and the Migration Policy Institute, think tanks like the Aspen Institute and the Center for American Progress, fundraising organizations like MoveOn org that stages anti Trump protests, and interventionist policy groups like the Global Centre for the Responsibility to Protect He has already donated millions to the democraticparty for 2020 There are more Main Streets in America than there are Wall Streets, ù he said, calling Elizabeth Warren who wants to tax the wealthy heavily the most qualified person to be president Soros also has a mortal enemy China, † the nation that fought a winning battle against his currency speculating in 1998, so now he calls Xi Jinping s China the worst threat to an open society ù Given what has happened to the other societies Soros has poured money into, Xi might take that as a compliment ",https://www.rt.com/usa/471880-soros-enemies-dictators-lobbying-china/
"14 Oct, 2019",Media uproar as video depicting Trump massacring news orgs shown at conservative event,"US media is up in arms after reports that a video depicting Donald Trump massacring fake news agencies and his political rivals was shown at an event held at one of his resorts The video in question is a remake of a scene from the 2014 dark comedy Kingsman: The Secret Service where Trump s head is superimposed on the main character, played by Colin Firth It was aired at an event held by the conservative group American Priority at the Trump National Doral Miami last week The video was first posted online in 2018 The fake Trump is shown shooting, stabbing, and killing Democrats like Barack Obama, Hillary Clinton, Maxine Waters, and Nancy Pelosi, in addition to blasting multiple avatars representing various Trump critical news organizations such as CNN and MSNBC and even one fake George Soros The president s son Donald Trump Jr, former White House Press Secretary Sarah Sanders, and Florida Governor Ron DeSantis were reportedly all in attendance at the event, though they deny seeing any such church of fake news video while also taking the opportunity to oppose all forms ùof violence I was there to speak at a prayer breakfast, where I spoke about unity and bringing the country together, ùSanderstoldthe New York Times I wasn t aware of any video, nor do I support violence of any kind against anyone, ùshe added NBC, NPR, The Huffington Post, Politico, Vox, Vice News, The Hill, BuzzFeed News, among others were all on the receiving end of the fictitious brutality That video was not produced by the campaign, and we do not condone violence, ùspokesperson for Trump s re election campaign Tim Murtaugh said For its part, American Priority denounced what it described as an unsanctioned ùvideo #AMPFest19official statement on unauthorized video pic twitter com/w6zzhZ4Lje Content was submitted by third parties and was not associated with or endorsed by the conference in any official capacity, ùsaid the organizer, Alex Phillips The New York Times reported the news Sunday, claiming it was sent a cellphone video taken at the event by an attendee via a third party The collective outrage over the year old video then swept across social media The White House Correspondents Association issued a Twitter statement, saying it was horrified ùat the depiction of violence toward journalists WHCA Statement on video depicting President Trump murdering journalists pic twitter com/52lHFaQjU2 CNN described the video as vile and horrific ùand called on the Trump campaign to denounce it immediately and in the strongest terms ùwhile claiming that anything less would constitute a tacit endorsement of political violence CNN statement on video shown at@realDonaldTrumpsupporter conference at Trump s Miami resort last week:pic twitter com/BVKI5N5a17 Trump previously invoked the ire of the mainstream media after sharing similar memes depicting him beating up the fake news media ù #FraudNewsCNN#FNNpic twitter com/WYUnHjjUjg ",https://www.rt.com/usa/470888-trump-massacre-meme-video/
"30 Sep, 2019",Democratic establishment belatedly embraces ‚Äòwhistleblowers‚Äô‚Ä¶but only the ‚Äòsafe‚Äô kind,"MoveOn, a major advocacy group fine tuned to the needs of democraticparty , has finally found a whistleblower it can support the CIA agent whose complaint triggered an impeachment inquiry against US President Donald Trump MoveOn, which describes itself as the largest independent progressive advocacy group in the US, hailed the still anonymous whistleblower for taking on great personal risk to defend our democracy ùby revealing Trump s call with Ukraine that this person only knew of second hand The organization, sponsored by many Democratic donors including billionaire George Soros, implored its millions of members to have the whistleblower s back ùwith donations and petition signatures MoveOn has even partnered with Whistleblower Aid a group that steadfastly opposes the release of classified information, equating such leaks with criminality and thus foisted a warped definition of whistleblowing on its massive audience, one which permits only safe ùdisclosures unlikely to ruffle establishment feathers MoveOn s decision to support the Trump whistleblower is what one might expect from a progressive organization as determined as any to push the president out the door But MoveOn has conspicuously avoided supporting national security whistleblowers in the past, including individuals who paid dearly for coming forward Its sudden change of heart reeks of ulterior motives to those who have advocated for those whistleblowers for years A pro whistleblower organization might be expected to put out petitions in support of military intelligence analyst Chelsea Manning, who is back in jail over refusing to testify against Wikileaks founder Julian Assange despite having her sentence commuted by President Barack Obama or raise money to support former CIA agents John Kiriakou and James Sterling, who both spent time in prison for blowing the whistle In fact, journalist and activist Norman Solomon had actually suggested to MoveOn that they take up Sterling s case in December 2015, after the whistleblower was sentenced to prison, only to be brushed off The group had definitely done a lot of testing on [NSA whistleblower Edward] Snowden and Manning in the past, but unfortunately nothing quite reached the level of member support where we were able to send it out, ù read the letter he received from the organization Have they changed their mind, or merely decided that the CIA whistleblower embraced by the media establishment, the Democrats, and the grassroots #Resistance for the potential to bring down Trump is the only one worth supporting? Not only is the current whistleblower ùa politically popular cause, but there are hints of high level collusion in this case The rules for intelligence community whistleblowers were quietly changed to allow the inclusion of secondhand knowledge of wrongdoing, not long before the complaint was filed about Trump s call with Ukrainian President Volodymyr Zelensky a call the so far anonymous intelligence official did not personally witness MoveOn s sudden change of heart sends a message to actual whistleblowers: if you don t have friends in high places, the progressive ùcommunity wants nothing to do with you Ironically, MoveOn was created with a completely different purpose more than two decades ago Its founders drafted a petition, subsequently signed by hundreds of thousands of Americans, calling for the country to move on ù from the efforts to impeach President Bill Clinton in 1998, which Democrats painted as a vast right wing conspiracy ù ",https://www.rt.com/usa/469953-moveon-support-whistleblowers-hypocrisy-trump/
"1 Aug, 2019",Soros gifts $5.1 million check to Democrats as he enters 2020 funding game,"Billionaire financier George Soros has created a super PAC and written a $5 1 million check for Democrats ahead of next year s election However, the liberal mega donor has not revealed which candidate will get his blessing Sorosspentmore than $20 million during the 2016 election, donating more than $9 million to Political Action Committees (PACs) supporting Hillary Clinton, and the rest on committees working to install Democrats in Congress and to boost minority turnout at the polls According torecordsfiled with the Federal Election Commission on Wednesday, the 88 year old billionaire kicked his 2020 efforts off with a deposit of $5 1 million into his own Democracy PAC, more than doubling the $2 1 million he had donated at this point in the 2016 cycle Though no doubt spurred on by a desire to unseat President Donald Trump, Soros has not revealed who among the two dozen Democratic hopefuls his PAC will bestow its wealth on Speaking to the Washington Post last year, the Hungarian born investor said he would stay out of the party s primaries, as playing favorites would divide the democraticparty ù Well known for funding liberal causes around the world, Soros fingerprints can also be found on some of the world s most powerful think tanks, including some with less than peaceful aims Soros funds the neoconservative Center for American Progress and the Atlantic Council a pro intervention lobby propped up by a slew of arms manufacturers The Hungarian investor has also beenlinkedto the pro democracy ù European group Avaaz, which has advocated for no fly zones in Libya and agitated for regime change in Venezuela and Iran In his broader quest to advance the cause of his brand of liberalism around the world, Soros has alsofundedFacebook s third party fact checking partners, to filter forbidden news and views from the platform In Soros native Hungary, Viktor Orban s government has made the billionaire the face of its anti immigration policies, landing it introublewith the European Union Soros has openly called for increased immigration and refugee flows to Europe and castigated Orban s government for securing its border Soros is not the democraticparty s largest donor In recent years billionaire environmental activist Tom Steyer has been the party s largest bankroller However, Steyer entered the presidential race himself last month, and with former New York Mayor Michael Bloomberg yet to drop his promised $500 milliongiga donation, Soros remains the largest donor of the 2020 race so far Prior to Soros filing, hedge fund manager Donald Sussman was thelargestdonor of the 2020 cycle, as of April at least Sussman gave more than $865,300 to Democrats, followed by Dirk Ziff heir to his father William Bernard Ziff s publishing fortune who chipped in $689,200 The largest donation to the Republican party so far is a $618,500 sum given by † investment banker Warren Stephens Donation season has yet to begin in earnest, and cash will likely begin to flow into the 2020 race quicker after next month s debate in Houston, Texas In a bid to whittle down a crowded field, the Democratic National Committee has decided that only candidates polling at more than two percent with at least 130,000 unique donors will be allowed to participate Presently, only seven candidates have announced that they meet this requirement ",https://www.rt.com/usa/465601-soros-millions-democrat-funding/
"4 Jun, 2019",Euromaidan activist with neo-Nazi links joins Facebook as public policy manager,"A Ukrainian activist who rejoiced at the sight of 48 anti Maidan protesters burning to death in Odessa in 2014 has been hired by Facebook ostensibly to combat Russian disinformation Kateryna Kruk will be working out of Warsaw in her new role as Facebook s public policy manager for Ukraine While Kruk s immediate duties are not clear, the announcement was met with enthusiasm by her followers, hoping she wouldunleasha crackdown on Kremlin trolls † Kruk has an unequivocal anti Russian reputation, having written for several international publications and on Twitter Kruk shot to prominence at the height of the mass protests that preceded the 2014 armed coup in Kiev, becoming a spokesman for Euromaidan as she live tweeted in English from the first days of the two month protest As the movement was hijacked by right wing nationalists led by the Right Sector and the far right, borderline neo Nazi Svoboda party, the situation quickly spiraled into violence Around that time, Kruk worked as a †staffer for Svoboda,praisingthe party for being Ukrainian focused, ùwhile expressing some reservations about its hardline ultra nationalist ideology Kruk might have had some concerns about the party, whichembracedUkrainian nationalist leader and Nazi collaborator Stepan Bandera as a hero, but it did not deter her from gloating over the deaths of several dozen of her political opponents in Odessa s trade union building in May 2014, which was set on fire by football hooligans as police seemingly stood by watching The people whoburnedto death and suffocated inside the building were peacefully protesting the coup in the central city square before being attacked by the rowdy gangs READ MORE: †Who checks the fact checkers? Facebook leaves verification to groups funded by Soros, US Congress Odessa cleaned itself from terrorists, proud for city fighting for its identity Glory to fallen heroes, ùKruk tweeted at the time Here is Facebook s newest disinfo warrior cheering the 2014 Odessa fire î where nearly 50 Ukrainians were killed by fascist and far right activists ù î †as an action that cleaned ù the city of terrorists ù Yikes pic twitter com/xowHNYDDcY Since then, she has briefly served as a spokesperson for Ukraine s Ministry of Agriculture (2014) and the Ministry of Health (2017), and managed social media and international communication for the Ukrainian Parliament She was one of the leading analysts ùof Stopfake org, a site thatpurportsto track Russian media lies ùabout Ukraine Her controversial background and statements did not prevent her from beinggivena Freedom Award by the Atlantic Council in 2014 for her live tweeting skills White Helmets get Atlantic Council Freedom Award, following in the footsteps of Kateryna Kruk & the People of Maidanpic twitter com/reN8Po7GjM Facebook has previously come under fire for carrying out a crusade against misinformation with questionable means The certified fact checkers the company has cooperated with have beenrevealedto have links to the US government and democraticparty mega donor George Soros ",https://www.rt.com/news/461006-ukraine-facebook-odessa-fire/
"22 May, 2019",Is Soros-linked Avaaz group a credible source on fake news? Mainstream media seems to think so,"Mainstream news outlets have eagerly reported on a study by the Avaaz campaign group, claiming far right disinformation groups have been spreading fake news in the lead up to EU elections î but is the group all that it seems? The Avaaz network bills itself as social action group bringing people powered politics to decision making everywhere ùand it s lateststudyclaims that more than 500 suspicious groups and Facebook pages are operating across major EU countries and spreading election disinformation to boost far right and anti EU parties ahead of crucial parliamentary elections The disinformation networks, Avaaz claimed, are even more popular than the pages belonging to official right wing and anti establishment groups and parties î and that they have been engaged in everything from sharing white supremacist content to Holocaust denial Be like Captain Von Trapp reject the far right!#EUElections2019are next week EU voters can RT to say:#YesWeVoteMay 23 26!pic twitter com/8BT02XrD8P Outlets from the Washington Post in the US to the Guardian in the UK have reported on the study, which was released just days before Europeans go to the polls î but reading the reports gives a clear impression that Avaaz is a non partisan and independent group, when the reality is much different Avaaz is not simply studying these elections, it is actively campaigning While Avaaz claims it accepts no money from governments or corporations, it is tied to other social action groups Res Publica and Moveon org (which has been partly funded by left wing Hungarian American billionaire George Soros) î and its co founders, Ricken Patel and Tom Perriello, have a history of supporting a US imperialist agenda Patel has previously worked for the US State Department and Amnesty International, while Perriello is a former US congressman who voted in favor of continuing the wars in Afghanistan and Iraq Soros was also a major campaign contributor to Perriello Is this really the kind of political action group that should be cited by the media without proper context? Independent journalists have had suspicions about Avaaz s own activity for years, noting its strong pro establishment and globalist leanings, which have even translated into outward support for US regime change wars around the world When the group is notpushingfor no fly zones in LibyaandSyria, oragitatingfor regime change in Venezuela and Iran, it is actively supporting centrist, neoliberal political figures across the EU and US Patel told the EUobserver last year that the majority ùof people across Europe stand with ùGerman Chancellor Angela Merkel and has also activelysupportedFrench President Emmanuel Macron with online videos and petitions While Avaaz is seemingly very concerned with the plight of citizens in places like Venezuela and Iran (it was also activelyinvolvedin promoting Iran s Green Revolution in 2009), it appears to be less concerned with the lives of ordinary Europeans The group has targeted the anti Macron Yellow Vest movement in France and †framed the protesters easy targets for spreading fake news ù î and to put the icing on the cake, blamed the swift spread of this alleged fake news on Russia, another of Avaaz s favorite targets Indeed, unsurprisingly, media reporting on so called election meddling ahead of EU elections has taken on an anti Russia hue, with many suggesting that disinformation groups are simply copying Russian tactics from the 2016 US election, when the democraticparty claimed Russian disinformation campaigns were a major factor in Hillary Clinton s loss to Donald Trump î a claim for which there remains exactly zero evidence One of these reports on the alleged copycat tactics quotes Ben Nimmo, a former NATO press officer, cited with regularity by mainstream journalists as though he is an impartial source Like clockwork, Nimmo popped up ahead of the EU elections to claim that domestic actors ùacross Europe are now simply doing what the Russians had already been doing ù î because it s easier to blame Russia for social discord in Europe than failed leadership and unpopular policies Once again, it appears that many of the groups claiming to help people recognize fake news online are some of the biggest and sneakiest purveyors of disinformation themselves î and they are frequently promoted by mainstream news outlets î if they are selling the correct narrative, that is Mainstream media continue to quote the founders of cybersecurity firm New Knowledge as credible experts on Russian disinformation tactics, even after the firm wasexposedby the New York Times for having run its own disinformation campaign during a 2017 Alabama senate race The New Knowledge crowd set up fake Russian social media accounts to support one candidate and then worked to publicly brand him as Moscow s pick By not even mentioning Avaaz s own sketchy links, and very clear political leanings, Western news reports citing its studies as completely credible and independent are simply engaging in their own kind of disinformation ",https://www.rt.com/news/460010-avaaz-eu-elections-disinformation/
